A1: R36's 纽北圈速榜 (20.8km 滚动起跑）
A2: 排名 | B2: 类别 | C2: 厂商 | D2: 车系 | E2: 型号 | F2: 圈速 | G2: 0-100 | H2: 100-160 | I2: 马力/扭矩 | J2: 驱动方式 | K2: 年份 | L2: 整备质量 | M2: 0-400 | N2: 备注
A3: 1 | B3: Automation | C3: Fenekz | D3: Bussiness Gen2 | E3: Hypervan Evo R | F3: 3.3657407407407399e-003 | G3: 1.42 | H3: 0.79000000000000004 | I3: 1448/980 | J3: M4 | K3: 2020 | L3: 890 | N3: 赛车 | O3: BNG车
A4: =A3+1 -> 2 | B4: Automation | C4: Leisurely | D4: GSX VI | E4: THOR/12 | F4: 3.4097222222222198e-003 | G4: 2.69 | H4: 0.56999999999999995 | I4: 2368/1787 | J4: M4 | K4: 2020 | N4: 赛车 | O4: AM车
A5: =A4+1 -> 3 | B5: Automation | C5: Visionow | D5: Venus | E5: Hyper Gen 1 | F5: 3.6423611111111101e-003 | G5: 1.2 | H5: 0.83999999999999997 | I5: 2368/1872 | J5: M4 | K5: 2020 | N5: 概念车 | O5: 混动
A6: =A5+1 -> 4 | B6: Automation | C6: Visionow | D6: VR25 | E6: Concept | F6: 3.7557870370370401e-003 | G6: 1.63 | H6: 1.1699999999999999 | I6: 1047/778 | J6: M4 | K6: 2020 | N6: 概念车 | O6: 纯电
A7: =A6+1 -> 5 | B7: Automation | C7: LEFLOT | D7: SCHWAESTERN | E7: PROJECT MAXIMUM I (EV Mode) | F7: 3.76157407407407e-003 | G7: 1.09 | H7: 0.85999999999999999 | I7: 502+521+672/598+551+700 | J7: M4 | K7: 2020 | N7: 双P3电机混动/概念车 | O7: 柴油
A8: =A7+1 -> 6 | B8: Automation | C8: Visionow | D8: Odin | E8: SP | F8: 3.85069444444444e-003 | G8: 1.76 | H8: 0.96999999999999997 | I8: 1097/1092 | J8: MR | K8: 2020 | L8: 864 | O8: 氢内燃机
A9: =A8+1 -> 7 | B9: Automation | C9: MUC | D9: SEN | E9: GT800 | F9: 3.8877314814814799e-003 | G9: 1.47 | H9: 1.53 | I9: 777/827 | J9: M4 | K9: 2020 | L9: 1100 | N9: 赛车 | O9: 燃气轮机
A10: =A9+1 -> 8 | B10: Automation | C10: Visionoid | D10: Uniaxle | E10: AWD | F10: 3.9432870370370403e-003 | G10: 1.86 | H10: 1.1699999999999999 | I10: 961/926 | J10: M4 | K10: 2020
A11: =A10+1 -> 9 | B11: Automation | C11: Leisurely | D11: GSX VII | E11: Magnolia | F11: 3.9444444444444397e-003 | G11: 1.69 | H11: 1.8 | I11: 783/632 | J11: M4 | K11: 2020 | L11: 1100 | N11: 赛车
A12: =A11+1 -> 10 | B12: Automation | C12: Fenekz | D12: V12 Gen3 | E12: GT800 'WhaleTail' | F12: 3.98842592592593e-003 | G12: 1.57 | H12: 1.48 | I12: 774/1253 | J12: M4 | K12: 2020 | L12: 1077 | N12: 赛车
A13: =A12+1 -> 11 | B13: Automation | C13: Visionoid | D13: Uniaxle | E13: RWD | F13: 3.99074074074074e-003 | G13: 1.49 | H13: 1.0700000000000001 | I13: 961/926 | J13: MR | K13: 2020
A14: =A13+1 -> 12 | B14: Automation | C14: Camso | D14: Hypersport | E14: Fenix (3Hz) | F14: 4.0335648148148101e-003 | G14: 1.33 | H14: 1.03 | I14: 1404/950 | J14: M4 | K14: 2020 | N14: 赛车
A15: =A14+1 -> 13 | B15: Automation | C15: Visionoid | D15: Selene | E15: Red Shift' | F15: 4.06597222222222e-003 | G15: 1.3999999999999999 | H15: 1.27 | I15: 1501/1348 | J15: MR | K15: 2020 | N15: 赛车
A16: =A15+1 -> 14 | B16: Automation | C16: Camso | D16: Hillclimber | E16: Proto | F16: 4.0810185185185203e-003 | G16: 1.68 | H16: 1.3200000000000001 | I16: 715/532 | J16: M4 | K16: 2020 | L16: 686 | N16: 赛车
A17: =A16+1 -> 15 | B17: Automation | C17: Visionow | D17: VR13 | E17: 900 | F17: 4.0925925925925904e-003 | G17: 1.32 | H17: 1.1699999999999999 | I17: 1156/958 | J17: M4 | K17: 2020 | N17: 概念车
A18: =A17+1 -> 16 | B18: Automation | C18: Visionow | D18: VR10 | E18: ULTRA Enhanced | F18: 4.1122685185185203e-003 | G18: 1.33 | H18: 0.92000000000000004 | I18: 2162/2106 | J18: M4 | K18: 2020 | N18: 概念车
A19: =A18+1 -> 17 | B19: BeamNG | C19: Gavril | D19: Vertex NA2 | E19: Extreme Time Attack (SEQ) | F19: 4.1215277777777804e-003 | G19: 1.67 | H19: 1.47 | I19: 1179/1148 | J19: F4 | K19: 2007 | N19: mod整车/赛车
A20: =A19+1 -> 18 | B20: Automation | C20: Fenekz | D20: Bussiness Gen2 | E20: Hypervan Unlimited Hybrid | F20: 4.1550925925925896e-003 | G20: 1.47 | H20: 0.80000000000000004 | I20: 1006+597/717+504 | J20: M4 | K20: 2020 | N20: 赛车/单P3电机混动
A21: =A20+1 -> 19 | B21: Automation | C21: Leisurely | D21: GSX VI | E21: PS1 | F21: 4.1666666666666701e-003 | G21: 1.97 | H21: 1.3300000000000001 | I21: 824/856 | J21: M4 | K21: 2020
A22: =A21+1 -> 20 | B22: Automation | C22: Visionow | D22: Victoria | E22: SP | F22: 4.2442129629629601e-003 | G22: 1.76 | H22: 1.6100000000000001 | I22: 835/928 | J22: M4 | K22: 2020 | L22: 1245
A23: =A22+1 -> 21 | B23: Automation | C23: Owl | D23: TRP | E23: 1 | F23: 4.2557870370370397e-003 | G23: 1.93 | H23: 1.6599999999999999 | I23: 709/648 | J23: M4 | K23: 2020 | L23: 1078
A24: =A23+1 -> 22 | B24: Automation | C24: Fenekz | D24: Bussiness Gen2 | E24: Hypervan | F24: 4.2858796296296299e-003 | G24: 1.83 | H24: 1.49 | I24: 1000/916 | J24: M4 | K24: 2020 | N24: 赛车
A25: =A24+1 -> 23 | B25: Automation | C25: Camso | D25: Exotic | E25: Lite Pearl Edition (3Hz) | F25: 4.3067129629629601e-003 | G25: 1.74 | H25: 1.6499999999999999 | I25: 598/404 | J25: M4 | K25: 2020 | N25: 赛车
A26: =A25+1 -> 24 | B26: Automation | C26: Fenekz | D26: Executive | E26: A400 Circuit-85 | F26: 4.3622685185185197e-003 | G26: 2.63 | H26: 3.54 | I26: 400/590 | J26: F4 | K26: 2020 | L26: 1400 | N26: 赛车
A27: =A26+1 -> 25 | B27: Automation | C27: Leisurely | D27: CNR4 | E27: Ultimate Evolution | F27: 4.3738425925925898e-003 | G27: 2.04 | H27: 1.6000000000000001 | I27: 683/683 | J27: M4 | K27: 2018
A28: =A27+1 -> 26 | B28: Automation | C28: Camso | D28: Exotic | E28: Lite (3Hz) | F28: 4.4004629629629602e-003 | G28: 1.99 | H28: 2.4700000000000002 | I28: 278/203 | J28: MR | K28: 2020 | N28: 赛车
A29: =A28+1 -> 27 | B29: Automation | C29: Fenekz | D29: Executive | E29: Electrified R 85-Package | F29: 4.4537037037037002e-003 | G29: 2.61 | H29: 1.6499999999999999 | I29: 334+1072/497+848 | J29: E4(D) | K29: 2020 | L29: 1874 | M29: 8.9600000000000009 | N29: 双电机纯电动
A30: =A29+1 -> 28 | B30: Automation | C30: DELUXACE | D30: THE-GT AVP | E30: P&L40E 900 RX GT2 | F30: 4.4571759259259304e-003 | G30: 1.36 | H30: 1.8500000000000001 | I30: 690+113+200/974+119+200 | J30: F4 | K30: 2020 | N30: 双P3电机混动/概念车
A31: =A30+1 -> 29 | B31: Automation | C31: Visionoid | D31: H-Motion | E31: Air-2 Gracetail | F31: 4.5543981481481503e-003 | G31: 1.77 | H31: 1.77 | I31: 791/828 | J31: M4 | K31: 2020
A32: =A31+1 -> 30 | B32: Automation | C32: IND | D32: CITRA | E32: SpeedUltra RG 17 2.0T | F32: 4.5590277777777799e-003 | G32: 2.41 | H32: 3.1600000000000001 | I32: 384/475 | J32: F4 | K32: 2020 | L32: 1400 | N32: 赛车
A33: =A32+1 -> 31 | B33: Automation | C33: Camso | D33: Exotic | E33: Lite (2.2Hz) | F33: 4.5763888888888903e-003 | G33: 2.04 | H33: 2.5899999999999999 | I33: 278/203 | J33: MR | K33: 2020 | N33: 赛车
A34: =A33+1 -> 32 | B34: Automation | C34: Owl Racers | D34: 332 Cup | E34: GT4 | F34: 4.6064814814814796e-003 | G34: 3. | H34: 3.7999999999999998 | I34: 390/394 | J34: FR | K34: 2020 | N34: 赛车
A35: =A34+1 -> 33 | B35: Automation | C35: Leisurely | D35: Feilian | E35: NEO | F35: 4.6539351851851898e-003 | G35: 2.0800000000000001 | H35: 1.7 | I35: 707/508 | J35: M4 | K35: 2020 | L35: 944
A36: =A35+1 -> 34 | B36: Automation | C36: Visionoid | D36: Pronghorn | E36: Silhouette' | F36: 4.6585648148148202e-003 | G36: 1.9399999999999999 | H36: 2. | I36: 738/800 | J36: RR | K36: 2020
A37: =A36+1 -> 35 | B37: BeamNG | C37: Hirochi | D37: SBR4 | E37: Hillclimb-Asphalt (DCT) | F37: 4.67708333333333e-003 | G37: 2.3100000000000001 | H37: 2.3599999999999999 | I37: 811/739 | J37: R4 | K37: 2013 | N37: 赛车
A38: =A37+1 -> 36 | B38: BeamNG | C38: Bugatti | D38: Chiron | E38: Profilee | F38: 4.7118055555555602e-003 | G38: 1.47 | H38: 1.6299999999999999 | I38: 1546/1600 | J38: M4 | K38: 2022 | N38: mod整车
A39: =A38+1 -> 37 | B39: Automation | C39: Fenekz | D39: Tempest | E39: 550x P&L Nür | F39: 4.7245370370370401e-003 | G39: 2.3300000000000001 | H39: 2.6000000000000001 | I39: 634/811 | J39: F4 | K39: 2020 | L39: 1495
A40: =A39+1 -> 38 | B40: Automation | C40: Camso | D40: Exotic | E40: Lite (3Hz Street-Legal Restricted) | F40: 4.7268518518518501e-003 | G40: 2.4700000000000002 | H40: 3.0299999999999998 | I40: 251/203 | J40: MR | K40: 2020
A41: =A40+1 -> 39 | B41: BeamNG | C41: Bugatti | D41: Chiron | E41: Pur Sport | F41: 4.7430555555555603e-003 | G41: 1.5 | H41: 1.6599999999999999 | I41: 1546/1600 | J41: M4 | K41: 2021 | N41: mod整车
A42: =A41+1 -> 40 | B42: Automation | C42: EPEX | D42: 80 | E42: Storm | F42: 4.7662037037036996e-003 | G42: 2.8500000000000001 | H42: 1.8999999999999999 | I42: 281+659/380+893 | J42: E4(D) | K42: 2020 | L42: 1735 | M42: 9.7400000000000002 | N42: 双电机纯电动
A43: =A42+1 -> 41 | B43: BeamNG | C43: Civetta | D43: Scintilla | E43: Amateur Rally-Asphalt (Sequential) | F43: 4.7835648148148203e-003 | G43: 2.8300000000000001 | H43: 2.46 | I43: 679/579 | J43: M4 | K43: 2020 | N43: 赛车
A44: =A43+1 -> 42 | B44: Automation | C44: FORAL | D44: LOPER LSM | E44: 3.0TE SU+ Edition Pre-Production | F44: 4.7858796296296304e-003 | G44: 2.21 | H44: 2.3700000000000001 | I44: 631+65/683+79 | J44: F4 | K44: 2020 | L44: 1496 | N44: 单P3电机混动/解除限速
A45: =A44+1 -> 43 | B45: Automation | C45: Fenekz | D45: Elegance | E45: A850-8 S | F45: 4.7939814814814798e-003 | G45: 1.8999999999999999 | H45: 2.2000000000000002 | I45: 846/988 | J45: F4 | K45: 2020 | N45: 解除限速
A46: =A45+1 -> 44 | B46: Automation | C46: CC | D46: A1 | E46: GTI TCR | F46: 4.8009259259259298e-003 | G46: 2.96 | H46: 3.7000000000000002 | I46: 340/542 | J46: FF | K46: 2020 | N46: 赛车
A47: =A46+1 -> 45 | B47: Automation | C47: Visionoid | D47: Verdun | E47: 350S | F47: 4.8067129629629597e-003 | G47: 1.89 | H47: 1.9299999999999999 | I47: 733/796 | J47: MR | K47: 2020
A48: =A47+1 -> 46 | B48: BeamNG | C48: Cherrier | D48: FCV | E48: Vivace Hillclimb (Sequential) | F48: 4.8101851851851899e-003 | G48: 2.0299999999999998 | H48: 2.3399999999999999 | I48: 683/782 | J48: F4 | K48: 2020 | L48: 1428 | N48: 赛车
A49: =A48+1 -> 47 | B49: Automation | C49: FORAL | D49: LOPER LSM | E49: 3.0TE SU Edition | F49: 4.8206018518518502e-003 | G49: 2.27 | H49: 2.3599999999999999 | I49: 631+113/683+119 | J49: F4 | K49: 2020 | L49: 1653 | N49: 单P3电机混动/解除限速
A50: =A49+1 -> 48 | B50: Automation | C50: Fenekz | D50: Ute | E50: 454 LSX SuperUte | F50: 4.8206018518518502e-003 | G50: 1.73 | H50: 2.1200000000000001 | I50: 800/810 | J50: F4 | K50: 2020
A51: =A50+1 -> 49 | B51: Automation | C51: Aston-Martin | D51: Vanquish | E51: 6.0T S Coupe | F51: 4.8263888888888896e-003 | G51: 1.73 | H51: 2.0299999999999998 | I51: 778/1229 | J51: F4 | K51: 2024 | N51: 同人作品（非真车）
A52: =A51+1 -> 50 | B52: Automation | C52: Fenekz | D52: Orkan | E52: 600 GT-6x Prototype | F52: 4.8368055555555603e-003 | G52: 2.07 | H52: 2.3799999999999999 | I52: 678/793 | J52: M4 | K52: 2020
A53: =A52+1 -> 51 | B53: Automation | C53: Fenekz | D53: Tribute 306 | E53: A300 R DCT 3dr Hatchback | F53: 4.8472222222222198e-003 | G53: 2.09 | H53: 2.5299999999999998 | I53: 295/345 | J53: F4 | K53: 2020
A54: =A53+1 -> 52 | B54: Automation | C54: Fenekz | D54: De Luxe Classic | E54: 800 V-10 Bi-Turbo Ultimate Edition | F54: 4.8483796296296296e-003 | G54: 1.83 | H54: 2.1699999999999999 | I54: 794/789 | J54: F4 | K54: 2000 | N54: 解除限速
A55: =A54+1 -> 53 | B55: Automation | C55: Visionow | D55: VR6 | E55: LEMAN EDITION | F55: 4.8495370370370402e-003 | G55: 2.17 | H55: 2.5699999999999998 | I55: 549/614 | J55: MR | K55: 2020
A56: =A55+1 -> 54 | B56: Automation | C56: Fenekz | D56: LongTail | E56: A750 | F56: 4.8576388888888896e-003 | G56: 2.24 | H56: 2.2999999999999998 | I56: 733/901/R4 | J56: R4 | K56: 2020
A57: =A56+1 -> 55 | B57: BeamNG | C57: Bugatti | D57: Chiron | E57: Sport | F57: 4.8668981481481497e-003 | G57: 1.7 | H57: 1.71 | I57: 1500/1600 | J57: M4 | K57: 2018 | L57: 1991 | N57: mod整车
A58: =A57+1 -> 56 | B58: BeamNG | C58: Bugatti | D58: Chiron | E58: First Edition | F58: 4.8900462962963003e-003 | G58: 1.71 | H58: 1.72 | I58: 1500/1600 | J58: M4 | K58: 2016 | L58: 1995 | N58: mod整车
A59: =A58+1 -> 57 | B59: Automation | C59: Fenekz | D59: Executive | E59: Electrified R | F59: 4.8900462962963003e-003 | G59: 2.06 | H59: 1.6699999999999999 | I59: 310x2+380x2/392x2+480x2 | J59: E4(Q) | K59: 2020 | L59: 2395 | M59: 8.6199999999999992 | N59: 四电机纯电动/解除限速
A60: =A59+1 -> 58 | B60: Automation | C60: Visionow | D60: VS3 | E60: ULTRA Enhanced 2025 | F60: 4.9004629629629598e-003 | G60: 2.46 | H60: 2.8599999999999999 | I60: 549/614 | J60: F4 | K60: 2020
A61: =A60+1 -> 59 | B61: Automation | C61: IND | D61: CITRA | E61: SpeedUltra RX56 1.6TE | F61: 4.9027777777777802e-003 | G61: 2.84 | H61: 4.7699999999999996 | I61: 328+70/400+200 | J61: F4 | K61: 2020 | N61: 单P3电机混动/赛车
A62: =A61+1 -> 60 | B62: Automation | C62: Aya羽绫 | D62: Pica Pica | E62: GP-C 2025 289 | F62: 4.95717592592593e-003 | G62: 2.67 | H62: 2.9900000000000002 | I62: 506/559 | J62: FR | K62: 2020
A63: =A62+1 -> 61 | B63: BeamNG | C63: Bugatti | D63: Chiron | E63: Super Sport 300+ | F63: 4.9652777777777803e-003 | G63: 1.6000000000000001 | H63: 1.6299999999999999 | I63: 1600/1612 | J63: M4 | K63: 2022 | L63: 1987 | M63: 8.25 | N63: mod整车
A64: =A63+1 -> 62 | B64: BeamNG | C64: Hirochi | D64: SBR4 | E64: RWD GTs6-r 'Empyrean' | F64: 4.9722222222222199e-003 | G64: 2.63 | H64: 2.96 | I64: 522/494 | J64: RR | K64: 2017 | L64: 1451 | N64: mod配置
A65: =A64+1 -> 63 | B65: BeamNG | C65: Civetta | D65: Scintilla | E65: GTs Corse (DCT) | F65: 4.9780092592592601e-003 | G65: 2.18 | H65: 2.2200000000000002 | I65: 716/622 | J65: MR | K65: 2020
A66: =A65+1 -> 64 | B66: Automation | C66: DELUXACE | D66: THE-GT AVP | E66: P&L40E 900 RX | F66: 4.9837962962963004e-003 | G66: 1.66 | H66: 2. | I66: 690+113+200/974+119+200 | J66: F4 | K66: 2020 | N66: 双P3电机混动
A67: =A66+1 -> 65 | B67: Automation | C67: Fenekz | D67: V12 Gen2 | E67: A850 S Luxe-Activa | F67: 5.0000000000000001e-003 | G67: 2.03 | H67: 2.4500000000000002 | I67: 851/1468 | J67: F4 | K67: 2020 | L67: 2183 | N67: 解除限速
A68: =A67+1 -> 66 | B68: Automation | C68: Visionoid | D68: Pronghorn | E68: GT-T (DCT) | F68: 5.01273148148148e-003 | G68: 3. | H68: 3.1000000000000001 | I68: 478/538 | J68: RR | K68: 2020 | L68: 1404
A69: =A68+1 -> 67 | B69: Automation | C69: Fenekz | D69: Tempest | E69: 550x P&L | F69: 5.0162037037036998e-003 | G69: 2.6000000000000001 | H69: 2.98 | I69: 595/807 | J69: F4 | K69: 2020 | L69: 1602
A70: =A69+1 -> 68 | B70: Automation | C70: Visionow | D70: Artemis | E70: 900 | F70: 5.0162037037036998e-003 | G70: 2.57 | H70: 3.0699999999999998 | I70: 696/1160 | J70: F4 | K70: 2020 | L70: 1936
A71: =A70+1 -> 69 | B71: BeamNG | C71: ETK | D71: K-Series | E71: PUR 1000Z Speedster (DCT) | F71: 5.0312500000000001e-003 | G71: 2.24 | H71: 1.7 | I71: 1014/1150 | J71: F4 | K71: 2015 | L71: 1595 | M71: 8.5 | N71: mod配置
A72: =A71+1 -> 70 | B72: Automation | C72: Apache | D72: Chrechy | E72: Mystic Chaos | F72: 5.0335648148148102e-003 | G72: 1.96 | H72: 2.4300000000000002 | I72: 1023/1785 | J72: F4 | K72: 2020
A73: =A72+1 -> 71 | B73: Automation | C73: Visionow | D73: VS3 | E73: WTCR Edition | F73: 5.0486111111111096e-003 | G73: 3.63 | H73: 4.0099999999999998 | I73: 549/614 | J73: FF | K73: 2020
A74: =A73+1 -> 72 | B74: BeamNG | C74: Civetta | D74: Scintilla | E74: GTx (DCT) | F74: 5.07291666666667e-003 | G74: 2.2000000000000002 | H74: 2.5600000000000001 | I74: 661/609 | J74: M4 | K74: 2020
A75: =A74+1 -> 73 | B75: Automation | C75: Fenekz | D75: Tempest | E75: 500x V8 'Gewitter' MT | F75: 5.0798611111111096e-003 | G75: 3.04 | H75: 3.8100000000000001 | I75: 501/499 | J75: F4 | K75: 2020 | L75: 1501
A76: =A75+1 -> 74 | B76: BeamNG | C76: Civetta | D76: Mondello | E76: Civetta GT Cup Stradale (SEQ) | F76: 5.0810185185185203e-003 | G76: 3.6200000000000001 | H76: 3.23 | I76: 527/400 | J76: MR | K76: 2001 | N76: mod整车
A77: =A76+1 -> 75 | B77: BeamNG | C77: Civetta | D77: Scintilla | E77: GTs (DCT) | F77: 5.0879629629629599e-003 | G77: 2.1899999999999999 | H77: 2.4399999999999999 | I77: 661/609 | J77: MR | K77: 2020
A78: =A77+1 -> 76 | B78: Automation | C78: Fenekz | D78: De Luxe Classic | E78: 550 V-10 Bi-Turbo | F78: 5.09490740740741e-003 | G78: 3.3300000000000001 | H78: 3.23 | I78: 577/857 | J78: F4 | K78: 1980
A79: =A78+1 -> 77 | B79: Automation | C79: Fenekz | D79: Tempest | E79: 400xd PHEV | F79: 5.0983796296296298e-003 | G79: 3.21 | H79: 3.8999999999999999 | I79: 326+149/691+250 | J79: F4 | K79: 2020 | L79: 1780 | N79: 柴油机+单P3电机混动
A80: =A79+1 -> 78 | B80: Automation | C80: DELUXACE | D80: KM LSM | E80: P&L30E | F80: 5.1018518518518496e-003 | G80: 2.2200000000000002 | H80: 2.1600000000000001 | I80: 441+201+281/610+220+300 | J80: F4 | K80: 2020 | L80: 1726 | N80: 双P3电机混动
A81: =A80+1 -> 79 | B81: BeamNG | C81: ETK | D81: K-Series | E81: GT-IV (DCT) | F81: 5.1018518518518496e-003 | G81: 2.8399999999999999 | H81: 3.6699999999999999 | I81: 428/453 | J81: FR | K81: 2015 | L81: 1438 | N81: 赛车
A82: =A81+1 -> 80 | B82: BeamNG | C82: ETK | D82: I-Series | E82: Knallhart (M) | F82: 5.1030092592592603e-003 | G82: 2.9900000000000002 | H82: 3.1000000000000001 | I82: 554/795 | J82: F4 | K82: 1985 | N82: 高性能散热器
A83: =A82+1 -> 81 | B83: Automation | C83: LOTUS | D83: ESSENCE | E83: 1.6 DCT Carbon | F83: 5.1111111111111097e-003 | G83: 2.51 | H83: 3.23 | I83: 304/386 | J83: MR | K83: 2020
A84: =A83+1 -> 82 | B84: Automation | C84: Fenekz | D84: Verve II | E84: P&L Rallye | F84: 5.1250000000000002e-003 | G84: 3.37 | H84: 4.5800000000000001 | I84: 323/432 | J84: F4 | K84: 2020 | L84: 1309
A85: =A84+1 -> 83 | B85: BeamNG | C85: Soliad | D85: Wendover | E85: Hillclimb (Sequential) | F85: 5.1319444444444398e-003 | G85: 2.53 | H85: 3.23 | I85: 664/953 | J85: F4 | K85: 1987 | N85: 赛车
A86: =A85+1 -> 84 | B86: BeamNG | C86: Hirochi | D86: SBR4 | E86: AWD TT S Hybrid 'Cyborg' (DCT) | F86: 5.1377314814814801e-003 | G86: 2.8999999999999999 | H86: 2.6000000000000001 | I86: 426+196/449+339 | J86: R4 | K86: 2017 | L86: 1466 | M86: 10.199999999999999 | N86: mod配置/单P2电机混动
A87: =A86+1 -> 85 | B87: BeamNG | C87: Civetta | D87: Scintilla | E87: GT (DCT) | F87: 5.1423611111111097e-003 | G87: 2.33 | H87: 2.7000000000000002 | I87: 610/549 | J87: MR | K87: 2020
A88: =A87+1 -> 86 | B88: Automation | C88: Fenekz | D88: GTC | E88: 350 V8 P&L Gran-Coupe Nür | F88: 5.1493055555555597e-003 | G88: 3.81 | H88: 3.3900000000000001 | I88: 408/648 | J88: FF | K88: 2020 | L88: 1296
A89: =A88+1 -> 87 | B89: BeamNG | C89: Gavril | D89: Roamer | E89: Big Daddy by TEK | F89: 5.1539351851851902e-003 | G89: 2.67 | H89: 2.8300000000000001 | I89: 970/1257 | J89: F4 | K89: 1992 | N89: 自定义配置
A90: =A89+1 -> 88 | B90: Automation | C90: Fenekz | D90: V12 Gen3 | E90: A700 Royal-Air | F90: 5.1643518518518497e-003 | G90: 2.45 | H90: 2.79 | I90: 779/1080 | J90: F4 | K90: 2020 | N90: 解除限速
A91: =A90+1 -> 89 | B91: BeamNG | C91: Bruckell | D91: Bastion | E91: Hotlap Special (M) | F91: 5.1678240740740703e-003 | G91: 3.16 | H91: 3.5699999999999998 | I91: 614/907 | J91: FR | K91: 2016 | N91: 赛车
A92: =A91+1 -> 90 | B92: BeamNG | C92: Civetta | D92: Mondello | E92: Trackday (M) | F92: 5.1840277777777796e-003 | G92: 3.67 | H92: 4.2300000000000004 | I92: 407/363 | J92: MR | K92: 2001 | N92: mod整车/赛车
A93: =A92+1 -> 91 | B93: BeamNG | C93: ETK | D93: K-Series | E93: Kc8x ttSport+ (DCT) | F93: 5.1851851851851902e-003 | G93: 2.43 | H93: 2.9300000000000002 | I93: 604/708 | J93: F4 | K93: 2015 | L93: 1659
A94: =A93+1 -> 92 | B94: BeamNG | C94: Cherrier | D94: FCV | E94: Emousse P&L 20+ Twincharged | F94: 5.1932870370370397e-003 | G94: 2.8900000000000001 | H94: 3.5299999999999998 | I94: 427/530 | J94: F4 | K94: 2024 | N94: mod车身/定制传动/概念车
A95: =A94+1 -> 93 | B95: Automation | C95: Fire | D95: Fox | E95: 16RTD | F95: 5.2199074074074101e-003 | G95: 3.8999999999999999 | H95: 4.5099999999999998 | I95: 292/411 | J95: FF | K95: 2020 | L95: 1198
A96: =A95+1 -> 94 | B96: BeamNG | C96: ETK | D96: 800-Series | E96: 826 ttSport+ Coupe (DCT) | F96: 5.2210648148148103e-003 | G96: 2.7400000000000002 | H96: 3.3300000000000001 | I96: 509/606 | J96: F4 | K96: 2013 | L96: 1603 | N96: mod车身
A97: =A96+1 -> 95 | B97: BeamNG | C97: ETK | D97: K-Series | E97: Rennspecht KR (A) | F97: 5.2268518518518497e-003 | G97: 2.35 | H97: 2.8599999999999999 | I97: 632/787 | J97: F4 | K97: 2015 | L97: 1644
A98: =A97+1 -> 96 | B98: BeamNG | C98: Bruckell | D98: LeGran | E98: 1.8 Turbo AWD Group A Touring Car (M) | F98: 5.2303240740740704e-003 | G98: 3.3599999999999999 | H98: 4.7599999999999998 | I98: 323/397 | J98: F4 | K98: 1988 | N98: mod配置/赛车
A99: =A98+1 -> 97 | B99: Automation | C99: Fenekz | D99: V12 Gen3 | E99: A700 Royal-Air Prototype | F99: 5.2384259259259302e-003 | G99: 2.3999999999999999 | H99: 2.7400000000000002 | I99: 774/1069 | J99: F4 | K99: 2020 | N99: 解除限速
A100: =A99+1 -> 98 | B100: BeamNG | C100: Hirochi | D100: SBR4 | E100: eSBR 800 | F100: 5.2407407407407403e-003 | G100: 2.26 | H100: 1.9099999999999999 | I100: 298+512/321+631 | J100: E4(D) | K100: 2013 | L100: 1661 | M100: 9.5199999999999996 | N100: 双电机纯电动
A101: =A100+1 -> 99 | B101: BeamNG | C101: ETK | D101: I-Series | E101: 2400ti Evo Group.A Touring Car (M) | F101: 5.2500000000000003e-003 | G101: 2.8999999999999999 | H101: 3.5299999999999998 | I101: 420/449 | J101: FR | K101: 1987 | N101: mod配置/赛车
A102: =A101+1 -> 100 | B102: BeamNG | C102: ETK | D102: 800-Series | E102: 846 ttSport+ (DCT) | F102: 5.2557870370370397e-003 | G102: 2.83 | H102: 3.4100000000000001 | I102: 509/606 | J102: F4 | K102: 2013 | L102: 1645
A103: =A102+1 -> 101 | B103: Automation | C103: Visionoid | D103: Cynical | E103: 400 Athlete+ | F103: 5.2789351851851903e-003 | G103: 3.2000000000000002 | H103: 4.0300000000000002 | I103: 422/589 | J103: F4 | K103: 2020 | L103: 1560
A104: =A103+1 -> 102 | B104: Automation | C104: AMMC | D104: Atract | E104: LR | F104: 5.28587962962963e-003 | G104: 2.66 | H104: 2.9300000000000002 | I104: 503/479 | J104: FR | K104: 2007
A105: =A104+1 -> 103 | B105: Automation | C105: The Zenith | D105: Demons | E105: Leviathan | F105: 5.2870370370370397e-003 | G105: 3.77 | H105: 4.3200000000000003 | I105: 418/600 | J105: FF | K105: 2020 | L105: 1449
A106: =A105+1 -> 104 | B106: BeamNG | C106: Ibishu | D106: Pessima Zenith II | E106: JTCC | F106: 5.28819444444444e-003 | G106: 3.59 | H106: 4.5999999999999996 | I106: 311/312 | J106: FF | K106: 1994 | N106: mod整车/赛车
A107: =A106+1 -> 105 | B107: Automation | C107: Fenekz | D107: Modest | E107: A400 Tourer R36⁴ Tribute R | F107: 5.2928240740740696e-003 | G107: 3.73 | H107: 4.4400000000000004 | I107: 400/442 | J107: F4 | K107: 2010
A108: =A107+1 -> 106 | B108: BeamNG | C108: Lamborghini | D108: Gallardo | E108: LP570-4 Superleggera (SA) | F108: 5.3032407407407403e-003 | G108: 2.83 | H108: 3.1099999999999999 | I108: 581/567 | J108: M4 | K108: 2010 | N108: mod整车
A109: =A108+1 -> 107 | B109: Automation | C109: IND | D109: A4 LSM | E109: P&L30E | F109: 5.3055555555555599e-003 | G109: 2.55 | H109: 2.2599999999999998 | I109: 490+201+281/611+220+300 | J109: F4 | K109: 2020 | L109: 1978 | M109: 9.5700000000000003 | N109: 双P3电机混动/解除限速
A110: =A109+1 -> 108 | B110: BeamNG | C110: ETK | D110: I-Series | E110: 2400ti Group.A Touring Car (M) | F110: 5.3067129629629601e-003 | G110: 3.13 | H110: 4.2999999999999998 | I110: 343/473 | J110: FR | K110: 1987 | N110: mod配置/赛车
A111: =A110+1 -> 109 | B111: BeamNG | C111: ETK | D111: S-Series | E111: Ss8 ttSport GT-S Heritage Edition (DCT) | F111: 5.3136574074074102e-003 | G111: 3.05 | H111: 3.71 | I111: 592/701 | J111: F4 | K111: 2016 | L111: 2109 | M111: 10.869999999999999 | N111: mod整车 | O111: ETK PACK
A112: =A111+1 -> 110 | B112: BeamNG | C112: Hirochi | D112: SBR4 | E112: eSBR 500 | F112: 5.3136574074074102e-003 | G112: 2.98 | H112: 2.8999999999999999 | I112: 203+323/241+502 | J112: E4(D) | K112: 2013 | L112: 1623 | M112: 10.619999999999999 | N112: 单电机纯电动
A113: =A112+1 -> 111 | B113: BeamNG | C113: Cherrier | D113: FCV | E113: Emousse P&L 20 | F113: 5.31712962962963e-003 | G113: 3.27 | H113: 4.3700000000000001 | I113: 362/466 | J113: F4 | K113: 2024 | N113: mod车身/定制传动/概念车
A114: =A113+1 -> 112 | B114: Automation | C114: Currus | D114: 800 Coupe | E114: GL-6 i-AWD+ | F114: 5.3229166666666702e-003 | G114: 2.69 | H114: 3.6299999999999999 | I114: 526/824 | J114: F4 | K114: 2020
A115: =A114+1 -> 113 | B115: Automation | C115: Fenekz | D115: Everest | E115: A400 Rally Gravel | F115: 5.3263888888888901e-003 | G115: 2.83 | H115: 4.0700000000000003 | I115: 391/484 | J115: F4 | K115: 2020 | N115: 赛车
A116: =A115+1 -> 114 | B116: BeamNG | C116: Hirochi | D116: SBR4 | E116: TT S2 AWD (DCT) | F116: 5.3287037037037001e-003 | G116: 3.02 | H116: 3.4500000000000002 | I116: 454/570 | J116: R4 | K116: 2013
A117: =A116+1 -> 115 | B117: BeamNG | C117: Bruckell | D117: Moonhawk | E117: Track (M) | F117: 5.3310185185185197e-003 | G117: 4.2300000000000004 | H117: 4.29 | I117: 479/565 | J117: FR | K117: 1973 | N117: 赛车
A118: =A117+1 -> 116 | B118: Automation | C118: Fenekz | D118: Verve II M | E118: 350 Rally | F118: 5.3333333333333297e-003 | G118: 3.0299999999999998 | H118: 3.8999999999999999 | I118: 341/487 | J118: M4 | K118: 2020 | N118: 赛车
A119: =A118+1 -> 117 | B119: BeamNG | C119: ETK | D119: I-Series | E119: Track (M) | F119: 5.3344907407407403e-003 | G119: 3.4700000000000002 | H119: 4.1299999999999999 | I119: 418/513 | J119: FR | K119: 1987 | L119: 1468 | N119: 赛车
A120: =A119+1 -> 118 | B120: BeamNG | C120: ETK | D120: 800-Series | E120: PUR 600Z Sedan (DCT) | F120: 5.3368055555555599e-003 | G120: 3.4700000000000002 | H120: 3.3100000000000001 | I120: 609/521 | J120: FR | K120: 2013 | L120: 1665 | M120: 10.74 | N120: mod配置
A121: =A120+1 -> 119 | B121: BeamNG | C121: Gavril | D121: Vertex NA2 | E121: TrackSport Concept (DCT) | F121: 5.3379629629629602e-003 | G121: 4.4400000000000004 | H121: 4.9000000000000004 | I121: 314/414 | J121: FF | K121: 2010 | L121: 1338 | M121: 12.550000000000001 | N121: mod整车/概念车
A122: =A121+1 -> 120 | B122: BeamNG | C122: ETK | D122: S-Series | E122: Ss12 ttSport GT-R (DCT) | F122: 5.3414351851851904e-003 | G122: 2.8199999999999998 | H122: 3.27 | I122: 704/903 | J122: F4 | K122: 2016 | L122: 2272 | M122: 10.77 | N122: mod整车 | O122: ETK PACK
A123: =A122+1 -> 121 | B123: BeamNG | C123: ETK | D123: I-Series | E123: PUR-Tuned 'The Goldfish' (M) | F123: 5.3449074074074102e-003 | G123: 2.6000000000000001 | H123: 3.2000000000000002 | I123: 552/796 | J123: F4 | K123: 1990 | L123: 1507 | N123: mod配置
A124: =A123+1 -> 122 | B124: Automation | C124: Fenekz | D124: Oasis | E124: 400 P&L | F124: 5.34837962962963e-003 | G124: 3.9199999999999999 | H124: 4.1799999999999997 | I124: 397/504 | J124: FF | K124: 2020 | L124: 1550
A125: =A124+1 -> 123 | B125: Automation | C125: Currus | D125: 3-Kimery Lite | E125: SU 70 | F125: 5.3495370370370398e-003 | G125: 3.0299999999999998 | H125: 3.4700000000000002 | I125: 610/941 | J125: F4 | K125: 2020
A126: =A125+1 -> 124 | B126: BeamNG | C126: Civetta | D126: Mondello | E126: Corse (A) | F126: 5.3530092592592596e-003 | G126: 4.1299999999999999 | H126: 4.5300000000000002 | I126: 395/358 | J126: MR | K126: 2001 | N126: mod整车
A127: =A126+1 -> 125 | B127: Automation | C127: Visionoid | D127: Cynical | E127: Spirit-T | F127: 5.3553240740740696e-003 | G127: 4.4699999999999998 | H127: 5.2599999999999998 | I127: 313/326 | J127: FF | K127: 2020 | L127: 1316
A128: =A127+1 -> 126 | B128: Automation | C128: THUNDERIGHT | D128: 1X1 | E128: P&L800EV [FL2] | F128: 5.3622685185185197e-003 | G128: 5.1600000000000001 | H128: 2.6299999999999999 | I128: 230+271x2/276+298x2 | J128: E4(T) | K128: 2020 | N128: 三电机纯电动
A129: =A128+1 -> 127 | B129: Automation | C129: Fenekz | D129: V12 Gen1 | E129: 700 Quaddra Rocket | F129: 5.3668981481481502e-003 | G129: 2.8700000000000001 | H129: 3.4100000000000001 | I129: 714/909 | J129: F4 | K129: 1990 | L129: 2158 | M129: 10.83
A130: =A129+1 -> 128 | B130: BeamNG | C130: ETK | D130: I-Series | E130: LTCC 1987 | F130: 5.3715277777777798e-003 | G130: 3.8999999999999999 | H130: 5.1500000000000004 | I130: 265/321 | J130: FR | K130: 1987 | N130: mod配置/赛车
A131: =A130+1 -> 129 | B131: BeamNG | C131: Ibishu | D131: Pessima I | E131: LTCC 1987 | F131: 5.3715277777777798e-003 | G131: 4.25 | H131: 5.4299999999999997 | I131: 229/272 | J131: FF | K131: 1987 | N131: mod配置/赛车
A132: =A131+1 -> 130 | B132: Automation | C132: Visionoid | D132: Neutral | E132: RSi Clubsport | F132: 5.3738425925925898e-003 | G132: 3.91 | H132: 4.6299999999999999 | I132: 338/448 | J132: FF | K132: 2020
A133: =A132+1 -> 131 | B133: BeamNG | C133: ETK | D133: K-Series | E133: Kr8 ttSport (DCT)[SSRG] | F133: 5.3749999999999996e-003 | G133: 2.94 | H133: 3.6299999999999999 | I133: 475/452 | J133: FR | K133: 2015 | N133: mod车身
A134: =A133+1 -> 132 | B134: BeamNG | C134: ETK | D134: 800-Series | E134: 846 ttSport Heritage Edition (M) | F134: 5.3761574074074102e-003 | G134: 3.13 | H134: 3.9199999999999999 | I134: 469/567 | J134: FR | K134: 2013 | L134: 1598
A135: =A134+1 -> 133 | B135: Automation | C135: DELUXACE | D135: RM LSM | E135: P&L40E | F135: 5.3807870370370398e-003 | G135: 1.91 | H135: 1.8700000000000001 | I135: 592+266+413/743+319+460 | J135: F4 | K135: 2020 | L135: 1998 | N135: 双P3电机混动/解除限速
A136: =A135+1 -> 134 | B136: BeamNG | C136: ETK | D136: S-Series | E136: Ss8 ttSport+ (DCT) | F136: 5.3923611111111099e-003 | G136: 3.15 | H136: 3.98 | I136: 556/682 | J136: F4 | K136: 2016 | L136: 2103 | N136: mod整车 | O136: ETK PACK
A137: =A136+1 -> 135 | B137: BeamNG | C137: Gavril | D137: Grand Marshal | E137: Track (M) | F137: 5.3935185185185197e-003 | G137: 3.63 | H137: 4.7000000000000002 | I137: 436/791 | J137: FR | K137: 1990 | L137: 1815 | N137: 赛车
A138: =A137+1 -> 136 | B138: BeamNG | C138: ETK | D138: 800-Series | E138: Rennspecht 8R (A) | F138: 5.39930555555556e-003 | G138: 3.26 | H138: 3.8900000000000001 | I138: 510/459 | J138: F4 | K138: 2013 | L138: 1722
A139: =A138+1 -> 137 | B139: BeamNG | C139: ETK | D139: S-Series | E139: S12 ttSport GTS (A) | F139: 5.4004629629629602e-003 | G139: 2.33 | H139: 2.73 | I139: 693/866 | J139: F4 | K139: 2016 | N139: mod整车 | O139: Revamp
A140: =A139+1 -> 138 | B140: Automation | C140: Princess.Alicia | D140: 100R | E140: 70TD | F140: 5.40162037037037e-003 | G140: 3.59 | H140: 3.8900000000000001 | I140: 593/823 | J140: FR | K140: 2020 | N140: 解除限速
A141: =A140+1 -> 139 | B141: BeamNG | C141: Gavril | D141: Vertex NA2 | E141: Fission Thunderbolt Concept | F141: 5.4050925925925898e-003 | G141: 3.39 | H141: 3.21 | I141: 541/661 | J141: E4(D) | K141: 2011 | L141: 1769 | M141: 11.119999999999999 | N141: mod整车/双电机纯电动/概念车
A142: =A141+1 -> 140 | B142: Automation | C142: Currus | D142: 900 | E142: T8 Ultra i-AWD+ | F142: 5.4085648148148096e-003 | G142: 3.13 | H142: 4.2999999999999998 | I142: 561/814 | J142: F4 | K142: 2020
A143: =A142+1 -> 141 | B143: BeamNG | C143: ETK | D143: S-Series | E143: Rennspecht SR (A) | F143: 5.4201388888888901e-003 | G143: 3.06 | H143: 3.6899999999999999 | I143: 632/787 | J143: F4 | K143: 2016 | L143: 2103 | N143: mod整车 | O143: ETK PACK
A144: =A143+1 -> 142 | B144: BeamNG | C144: Ibishu | D144: Covet | E144: LTCC 1987 | F144: 5.4224537037037002e-003 | G144: 4.43 | H144: 5.6600000000000001 | I144: 234/222 | J144: FF | K144: 1987 | N144: mod配置/赛车
A145: =A144+1 -> 143 | B145: BeamNG | C145: Soliad | D145: Lansdale | E145: 4.4 V8 Tuner Special Supercharged AWD (M) | F145: 5.42361111111111e-003 | G145: 2.7999999999999998 | H145: 3.3399999999999999 | I145: 665/952 | J145: F4 | K145: 2004
A146: =A145+1 -> 144 | B146: Automation | C146: Visionow | D146: VICTORY | E146: 900 | F146: 5.4317129629629602e-003 | G146: 2.5899999999999999 | H146: 3.3199999999999998 | I146: 667/1099 | J146: F4 | K146: 2020 | L146: 2002
A147: =A146+1 -> 145 | B147: BeamNG | C147: Civetta | D147: Mondello | E147: Strada (A) | F147: 5.4317129629629602e-003 | G147: 4.3300000000000001 | H147: 5.3300000000000001 | I147: 360/349 | J147: MR | K147: 2001 | N147: mod整车
A148: =A147+1 -> 146 | B148: BeamNG | C148: Gavril | D148: Vertex NA2 | E148: TrackSport (DCT) | F148: 5.4374999999999996e-003 | G148: 4.9699999999999998 | H148: 6.2699999999999996 | I148: 252/333 | J148: FF | K148: 2010 | L148: 1313 | M148: 13.18 | N148: mod整车
A149: =A148+1 -> 147 | B149: BeamNG | C149: Bruckell | D149: LeGran | E149: LTCC 1987 | F149: 5.4386574074074103e-003 | G149: 4.0999999999999996 | H149: 5.4699999999999998 | I149: 252/325 | J149: FF | K149: 1987 | N149: mod配置/赛车
A150: =A149+1 -> 148 | B150: Automation | C150: THUNDERIGHT | D150: 1C1 | E150: P&L1000EV | F150: 5.4745370370370399e-003 | G150: 3.7599999999999998 | H150: 2.2000000000000002 | I150: 230+342x2/276+397x2 | J150: E4(T) | K150: 2020 | N150: 三电机纯电动
A151: =A150+1 -> 149 | B151: BeamNG | C151: ETK | D151: 800-Series | E151: 844 Track (M) | F151: 5.4803240740740698e-003 | G151: 4.63 | H151: 6.21 | I151: 267/370 | J151: FR | K151: 2013 | L151: 1481 | N151: 赛车
A152: =A151+1 -> 150 | B152: BeamNG | C152: Ibishu | D152: Pessima II | E152: V6 Turbo by 法鸡 | F152: 5.4872685185185198e-003 | G152: 3.71 | H152: 2.7599999999999998 | I152: 608/735 | J152: FF | K152: 1996 | L152: 1404 | N152: 自定义配置
A153: =A152+1 -> 151 | B153: BeamNG | C153: Hirochi | D153: CCF | E153: 280-6RS Sunset Final Edition (M) | F153: 5.4872685185185198e-003 | G153: 4.41 | H153: 5.0300000000000002 | I153: 284/296 | J153: FR | K153: 2025 | L153: 1216 | N153: mod整车
A154: =A153+1 -> 152 | B154: BeamNG | C154: Bruckell | D154: Bastion | E154: Redtail (A) | F154: 5.49305555555556e-003 | G154: 2.93 | H154: 2.9300000000000002 | I154: 820/1151 | J154: FR | K154: 2016
A155: =A154+1 -> 153 | B155: Automation | C155: Fenekz | D155: Tempest | E155: 370x V8 Luxe | F155: 5.4953703703703701e-003 | G155: 3.76 | H155: 5.0499999999999998 | I155: 371/525 | J155: F4 | K155: 2020 | L155: 1666
A156: =A155+1 -> 154 | B156: BeamNG | C156: ETK | D156: 1300-Series | E156: Rennspecht 13R (A) | F156: 5.4999999999999997e-003 | G156: 2.91 | H156: 3.3900000000000001 | I156: 632/787 | J156: F4 | K156: 2015 | L156: 1982 | N156: mod整车
A157: =A156+1 -> 155 | B157: BeamNG | C157: Procyon | D157: Vela | E157: S270 First Edition (DCT) | F157: 5.5023148148148097e-003 | G157: 4.28 | H157: 5.1200000000000001 | I157: 290/315 | J157: FR | K157: 2021 | L157: 1320 | N157: mod整车
A158: =A157+1 -> 156 | B158: Automation | C158: Polaris | D158: Classic | E158: R+ | F158: 5.5034722222222204e-003 | G158: 4.2999999999999998 | H158: 5.3499999999999996 | I158: 279/374 | J158: FF | K158: 2020 | L158: 1309
A159: =A158+1 -> 157 | B159: Automation | C159: Fenekz | D159: Tempest | E159: 330 S | F159: 5.5046296296296301e-003 | G159: 3.6800000000000002 | H159: 5.21 | I159: 354/565 | J159: FR | K159: 2020 | L159: 1579
A160: =A159+1 -> 158 | B160: BeamNG | C160: AW | D160: Astro | E160: Trackday (M) | F160: 5.5046296296296301e-003 | G160: 4.3300000000000001 | H160: 5.5700000000000003 | I160: 222/260 | J160: FF | K160: 1980 | N160: mod整车/赛车
A161: =A160+1 -> 159 | B161: BeamNG | C161: Arima | D161: CS200 Platform | E161: Celina EXiA Matikanetannhauser Itasha | F161: 5.5046296296296301e-003 | G161: 3.3999999999999999 | H161: 3.7599999999999998 | I161: 422/485 | J161: F4 | K161: 1992 | L161: 1375 | N161: mod整车
A162: =A161+1 -> 160 | B162: BeamNG | C162: Hirochi | D162: SBR4 | E162: RWD TT S (DCT) | F162: 5.5069444444444402e-003 | G162: 3.73 | H162: 4.5300000000000002 | I162: 350/417 | J162: RR | K162: 2013
A163: =A162+1 -> 161 | B163: BeamNG | C163: Cherrier | D163: FCV | E163: Vivace S 410Q Arsenic (DCT) | F163: 5.5196759259259296e-003 | G163: 3.3300000000000001 | H163: 4.2599999999999998 | I163: 409/523 | J163: F4 | K163: 2020 | L163: 1648 | M163: 11.23
A164: =A163+1 -> 162 | B164: BeamNG | C164: ETK | D164: K-Series | E164: Kc6x 360 (A) | F164: 5.5219907407407396e-003 | G164: 3.6600000000000001 | H164: 4.79 | I164: 367/464 | J164: F4 | K164: 2015 | L164: 1574 | N164: 解除限速
A165: =A164+1 -> 163 | B165: BeamNG | C165: ETK | D165: 1300-Series | E165: 1358 ttSport+ | F165: 5.5243055555555601e-003 | G165: 2.8999999999999999 | H165: 3.46 | I165: 604/708 | J165: F4 | K165: 2015 | L165: 1982 | N165: mod整车
A166: =A165+1 -> 164 | B166: BeamNG | C166: ETK | D166: K-Series | E166: Kc6 360 (A) | F166: 5.5300925925925899e-003 | G166: 3.4700000000000002 | H166: 4.5300000000000002 | I166: 367/464 | J166: FR | K166: 2015 | L166: 1527 | N166: 解除限速
A167: =A166+1 -> 165 | B167: Automation | C167: Cisalpina | D167: Baschirotto | E167: 300R-GTC | F167: 5.5312499999999997e-003 | G167: 4.1200000000000001 | H167: 5.1200000000000001 | I167: 297/423 | J167: FF | K167: 2020 | L167: 1286
A168: =A167+1 -> 166 | B168: BeamNG | C168: Gavril | D168: Bluebuck | E168: Stock Car (M) | F168: 5.5347222222222204e-003 | G168: 7.3300000000000001 | H168: 4.3399999999999999 | I168: 501/673 | J168: FR | K168: 1962 | N168: 赛车
A169: =A168+1 -> 167 | B169: BeamNG | C169: Bruckell | D169: Bastion | E169: Battlehawk (A) | F169: 5.5462962962963e-003 | G169: 3.0699999999999998 | H169: 3.3300000000000001 | I169: 718/1018 | J169: FR | K169: 2016
A170: =A169+1 -> 168 | B170: Automation | C170: Visionow | D170: VS2L | E170: SUPER Enhanced | F170: 5.5474537037037003e-003 | G170: 3.6299999999999999 | H170: 3.8399999999999999 | I170: 195+293/317+477 | J170: E4(D) | K170: 2020 | N170: 双电机纯电动
A171: =A170+1 -> 169 | B171: BeamNG | C171: Hirochi | D171: CCF | E171: 240-6S (DCT) | F171: 5.5497685185185198e-003 | G171: 4.7400000000000002 | H171: 5.4699999999999998 | I171: 243/275 | J171: FR | K171: 2021 | L171: 1216 | N171: mod整车
A172: =A171+1 -> 170 | B172: BeamNG | C172: Cherrier | D172: Rayonner | E172: S 550Q Arsenic Element (DCT) | F172: 5.5509259259259296e-003 | G172: 3.1299999999999999 | H172: 3.6699999999999999 | I172: 556/807 | J172: F4 | K172: 2018 | N172: mod整车
A173: =A172+1 -> 171 | B173: BeamNG | C173: Bruckell | D173: Moonhawk | E173: 378 V8 Group.A Touring Car (M) | F173: 5.5601851851851802e-003 | G173: 3.9300000000000002 | H173: 4.2300000000000004 | I173: 415/551 | J173: FR | K173: 1985 | N173: mod配置/赛车
A174: =A173+1 -> 172 | B174: Automation | C174: Currus | D174: 308-V | E174: 50 Ti Subaudi | F174: 5.5624999999999997e-003 | G174: 4.4699999999999998 | H174: 5.9500000000000002 | I174: 247/367 | J174: FF | K174: 2020 | L174: 1242
A175: =A174+1 -> 173 | B175: Automation | C175: Fenekz | D175: Executive | E175: A600-12 FlagShip | F175: 5.5648148148148098e-003 | G175: 3.1600000000000001 | H175: 3.8100000000000001 | I175: 645/1124 | J175: F4 | K175: 2020
A176: =A175+1 -> 174 | B176: BeamNG | C176: Gavril | D176: Scout | E176: Multiway 525RS (DCT) | F176: 5.56828703703704e-003 | G176: 3.5299999999999998 | H176: 4.7599999999999998 | I176: 410/524 | J176: F4 | K176: 2018 | N176: mod整车/高性能散热器
A177: =A176+1 -> 175 | B177: BeamNG | C177: ETK | D177: K-Series | E177: Kc6x 380d (A) | F177: 5.5729166666666696e-003 | G177: 3.2999999999999998 | H177: 4.5700000000000003 | I177: 381/745 | J177: F4 | K177: 2015 | L177: 1607 | N177: mod配置/解除限速
A178: =A177+1 -> 176 | B178: BeamNG | C178: Civetta | D178: Bolide | E178: 320 GTT Corse | F178: 5.5740740740740698e-003 | G178: 3.4300000000000002 | H178: 3.7000000000000002 | I178: 402/495 | J178: MR | K178: 1984 | L178: 1315
A179: =A178+1 -> 177 | B179: BeamNG | C179: ETK | D179: K-Series | E179: Kc6x 340 Autobahn Polizei (A) | F179: 5.5752314814814796e-003 | G179: 3.73 | H179: 5.0300000000000002 | I179: 346/464 | J179: F4 | K179: 2015 | L179: 1582
A180: =A179+1 -> 178 | B180: BeamNG | C180: Gavril | D180: Vertex NA2 | E180: RoadSport (A) | F180: 5.5833333333333299e-003 | G180: 3.4900000000000002 | H180: 4.4400000000000004 | I180: 400/550 | J180: F4 | K180: 2010 | L180: 1492 | M180: 11.550000000000001 | N180: mod整车
A181: =A180+1 -> 179 | B181: BeamNG | C181: Cherrier | D181: FCV | E181: Emousse Arsenic Concept | F181: 5.5983796296296302e-003 | G181: 3.33 | H181: 4.3300000000000001 | I181: 409/523 | J181: F4 | K181: 2020 | L181: 1638 | M181: 11.539999999999999 | N181: mod车身/概念车
A182: =A181+1 -> 180 | B182: Automation | C182: Fenekz | D182: Oasis | E182: 300-5 S | F182: 5.60185185185185e-003 | G182: 4.37 | H182: 5.4500000000000002 | I182: 318/437 | J182: FF | K182: 2020
A183: =A182+1 -> 181 | B183: Automation | C183: Plannium | D183: Vector | E183: V Biturbo | F183: 5.6030092592592598e-003 | G183: 4.66 | H183: 5.1600000000000001 | I183: 365/576 | J183: F4 | K183: 1989
A184: =A183+1 -> 182 | B184: Automation | C184: Farna | D184: 409 | E184: Coupe | F184: 5.6030092592592598e-003 | G184: 5.2000000000000002 | H184: 5.6699999999999999 | I184: 307/407 | J184: FF | K184: 2020 | L184: 1423
A185: =A184+1 -> 183 | B185: BeamNG | C185: Hirochi | D185: Sunburst | E185: 2.0 Sport RS AWD Coupe (DCT) | F185: 5.6030092592592598e-003 | G185: 3.84 | H185: 5.1500000000000004 | I185: 299/370 | J185: F4 | K185: 2009 | L185: 1371 | N185: mod车身
A186: =A185+1 -> 184 | B186: BeamNG | C186: Bruckell | D186: Bastion | E186: Sport GT 6.5 (A) | F186: 5.6041666666666696e-003 | G186: 4.16 | H186: 5.1600000000000001 | I186: 488/638 | J186: FR | K186: 2016 | N186: 解除限速
A187: =A186+1 -> 185 | B187: BeamNG | C187: Lamborghini | D187: Countach | E187: LP5000 QV (1988) | F187: 5.6134259259259297e-003 | G187: 3.24 | H187: 3.2400000000000002 | I187: 478/529 | J187: MR | K187: 1988 | L187: 1391 | N187: mod整车 | O187: 作者:John Tanner & DJ-3
A188: =A187+1 -> 186 | B188: Automation | C188: Fenekz | D188: Executive | E188: A450-8 Luxe | F188: 5.6134259259259297e-003 | G188: 3.33 | H188: 4.5300000000000002 | I188: 469/859 | J188: F4 | K188: 2020
A189: =A188+1 -> 187 | B189: BeamNG | C189: Cherrier | D189: Rayonner | E189: S 480Q Arsenic Estate (DCT) | F189: 5.6354166666666696e-003 | G189: 3.86 | H189: 4.3899999999999997 | I189: 490/638 | J189: F4 | K189: 2016 | N189: mod整车
A190: =A189+1 -> 188 | B190: BeamNG | C190: ETK | D190: K-Series | E190: Kc6x 310d (A) | F190: 5.6365740740740699e-003 | G190: 3.84 | H190: 5.3700000000000001 | I190: 327/641 | J190: F4 | K190: 2015 | L190: 1607
A191: =A190+1 -> 189 | B191: BeamNG | C191: Hirochi | D191: Sunburst | E191: 2.0 Sport RS AWD (DCT) | F191: 5.6377314814814797e-003 | G191: 3.8999999999999999 | H191: 5.1699999999999999 | I191: 299/370 | J191: F4 | K191: 2009 | L191: 1401
A192: =A191+1 -> 190 | B192: BeamNG | C192: Hirochi | D192: SBR4 | E192: AWD S (DCT) | F192: 5.6400462962963001e-003 | G192: 4.44 | H192: 5.71 | I192: 300/348/R4 | J192: R4 | K192: 2013
A193: =A192+1 -> 191 | B193: BeamNG | C193: Hirochi | D193: Sunburst | E193: 2.0 Sport RS AWD Hatchback (DCT) | F193: 5.64583333333333e-003 | G193: 3.92 | H193: 5.2699999999999996 | I193: 299/370 | J193: F4 | K193: 2009 | L193: 1404 | N193: mod车身
A194: =A193+1 -> 192 | B194: Automation | C194: FORAL | D194: ANNAN Classic | E194: P&L20E EP | F194: 5.6504629629629604e-003 | G194: 2.77 | H194: 5.5300000000000002 | I194: 342+113+200/433+119+200 | J194: F4 | K194: 2020 | N194: 双P3电机混动
A195: =A194+1 -> 193 | B195: BeamNG | C195: Hirochi | D195: Sunburst | E195: 2.0 Sport RS 320 AWD Wagon (M) | F195: 5.6539351851851898e-003 | G195: 3.94 | H195: 5.1900000000000004 | I195: 325/399 | J195: F4 | K195: 2009 | L195: 1408 | N195: mod车身
A196: =A195+1 -> 194 | B196: Automation | C196: EPEX | D196: L01 | E196: 300e | F196: 5.6666666666666697e-003 | G196: 4.24 | H196: 5.4100000000000001 | I196: 131+197/270+407 | J196: E4(D) | K196: 2020 | L196: 1493 | N196: 双电机纯电动
A197: =A196+1 -> 195 | B197: BeamNG | C197: Hirochi | D197: CCF | E197: 190-4R Cup Press Car (Sequential) | F197: 5.6678240740740699e-003 | G197: 5.87 | H197: 7.21 | I197: 196/242 | J197: FR | K197: 2019 | L197: 1200 | N197: mod整车/赛车
A198: =A197+1 -> 196 | B198: BeamNG | C198: Hirochi | D198: Sunburst | E198: 2.0 Sport RS AWD Wagon (DCT) | F198: 5.6678240740740699e-003 | G198: 4. | H198: 5.3200000000000003 | I198: 299/370 | J198: F4 | K198: 2009 | L198: 1426 | N198: mod车身
A199: =A198+1 -> 197 | B199: Automation | C199: Empir | D199: MX1 | E199: EK200 | F199: 5.6724537037037004e-003 | G199: 4.7599999999999998 | H199: 6.1399999999999997 | I199: 245/397 | J199: FF | K199: 2020 | L199: 1321 | O199: ABTC
A200: =A199+1 -> 198 | B200: Automation | C200: FORAL | D200: ANNAN Classic | E200: 2.0T GT-K R+ | F200: 5.6759259259259297e-003 | G200: 4.06 | H200: 4.7599999999999998 | I200: 342/433 | J200: FF | K200: 2020
A201: =A200+1 -> 199 | B201: BeamNG | C201: Gavril | D201: D-Series | E201: D15 Track (M) | F201: 5.67708333333333e-003 | G201: 4.5 | H201: 6.2999999999999998 | I201: 434/788 | J201: F4 | K201: 1998 | N201: 赛车
A202: =A201+1 -> 200 | B202: BeamNG | C202: Ibishu | D202: Claria | E202: Race (M) | F202: 5.67708333333333e-003 | G202: 4.36 | H202: 5.4000000000000004 | I202: 387/395 | J202: FR | K202: 1975 | L202: 1585 | N202: mod整车/赛车
A203: =A202+1 -> 201 | B203: Automation | C203: CHEVIONDA | D203: GLANDIO | E203: 1400 | F203: 5.6782407407407398e-003 | G203: 5.14 | H203: 7.0700000000000003 | I203: 199/270 | J203: FF | K203: 2020 | L203: 1182
A204: =A203+1 -> 202 | B204: BeamNG | C204: ETK | D204: S-Series | E204: Ss12ttx 600 (A) | F204: 5.6793981481481504e-003 | G204: 3.19 | H204: 4.0300000000000002 | I204: 610/800 | J204: F4 | K204: 2016 | L204: 2261 | O204: ETK PACK
A205: =A204+1 -> 203 | B205: Automation | C205: SEN | D205: Quatre | E205: F/S | F205: 5.6817129629629596e-003 | G205: 5.07 | H205: 7.1399999999999997 | I205: 239/353 | J205: FF | K205: 2020 | L205: 1447 | O205: 400th
A206: =A205+1 -> 204 | B206: BeamNG | C206: Cherrier | D206: Rayonner | E206: 500QL (DCT) | F206: 5.6828703703703702e-003 | G206: 3.43 | H206: 4.0999999999999996 | I206: 507/739 | J206: F4 | K206: 2018 | N206: mod整车/解除限速
A207: =A206+1 -> 205 | B207: BeamNG | C207: Hirochi | D207: SBR4 | E207: eSBR 300 | F207: 5.6863425925925927e-003 | G207: 4.28 | H207: 4.7800000000000002 | I207: 323/502 | J207: RR | K207: 2013 | L207: 1538 | M207: 12.32 | N207: 单电机纯电动
A208: =A207+1 -> 206 | B208: Automation | C208: MOTOP | D208: OTTER AVP | E208: 2.0TE S | F208: 5.6909722222222197e-003 | G208: 2.94 | H208: 4.8600000000000003 | I208: 275+113+200/385+119+200 | J208: F4 | K208: 2020 | N208: 双P3电机混动
A209: =A208+1 -> 207 | B209: BeamNG | C209: Cherrier | D209: FCV | E209: Vivace S 350Q (DCT) | F209: 5.6932870370370401e-003 | G209: 3.9700000000000002 | H209: 5.3099999999999996 | I209: 351/443 | J209: F4 | K209: 2020 | L209: 1666
A210: =A209+1 -> 208 | B210: Automation | C210: Visionoid | D210: Cynical | E210: 230 iFun | F210: 5.6944444444444403e-003 | G210: 4.98 | H210: 6.96 | I210: 236/349 | J210: FF | K210: 2020 | L210: 1387
A211: =A210+1 -> 209 | B211: Automation | C211: Miiku | D211: M150 | E211: GT1R | F211: 5.6990740740740699e-003 | G211: 4.43 | H211: 5.4299999999999997 | I211: 247/305 | J211: FF | K211: 2020 | L211: 1148
A212: =A211+1 -> 210 | B212: BeamNG | C212: ETK | D212: 800-Series | E212: 856ttx 340 (A) | F212: 5.7071759259259298e-003 | G212: 3.87 | H212: 5.2599999999999998 | I212: 346/464 | J212: F4 | K212: 2013
A213: =A212+1 -> 211 | B213: BeamNG | C213: Gavril | D213: Barstow | E213: Tracksport (M) | F213: 5.7094907407407398e-003 | G213: 5.51 | H213: 6. | I213: 347/475 | J213: FR | K213: 1969 | L213: 1593 | M213: 13.57
A214: =A213+1 -> 212 | B214: Automation | C214: Fenekz | D214: V12 Gen1 | E214: 550 Hammer | F214: 5.7233796296296303e-003 | G214: 3.69 | H214: 3.73 | I214: 570/816 | J214: FR | K214: 1985 | L214: 2191 | M214: 11.65
A215: =A214+1 -> 213 | B215: Automation | C215: Currus | D215: 800 Coupe | E215: GL B4 i-AWD+ | F215: 5.7256944444444404e-003 | G215: 4.53 | H215: 7.04 | I215: 278/387 | J215: F4 | K215: 2020
A216: =A215+1 -> 214 | B216: BeamNG | C216: Ibishu | D216: BX-Series | E216: Diana GTz-R (M) | F216: 5.7280092592592599e-003 | G216: 4.04 | H216: 5.7300000000000004 | I216: 287/419 | J216: F4 | K216: 1991 | N216: mod配置 | O216: 200th
A217: =A216+1 -> 215 | B217: Automation | C217: Fenekz | D217: Verve II | E217: 240xd S Highline | F217: 5.7291666666666697e-003 | G217: 4.38 | H217: 6.4400000000000004 | I217: 243/490 | J217: F4 | K217: 2020 | L217: 1411
A218: =A217+1 -> 216 | B218: BeamNG | C218: Lamborghini | D218: Countach | E218: LP5000S | F218: 5.7291666666666697e-003 | G218: 4.2000000000000002 | H218: 3.8399999999999999 | I218: 407/421 | J218: MR | K218: 1982 | L218: 1355 | N218: mod整车 | O218: 作者:John Tanner & DJ-3
A219: =A218+1 -> 217 | B219: Automation | C219: DGBC | D219: Leopard | E219: 2 | F219: 5.7326388888888904e-003 | G219: 3.9900000000000002 | H219: 4.5999999999999996 | I219: 358/414 | J219: FF | K219: 2020 | L219: 1496
A220: =A219+1 -> 218 | B220: Automation | C220: Fenekz | D220: Tempest | E220: 230xd S Shooting Brake | F220: 5.73958333333333e-003 | G220: 5.4000000000000004 | H220: 8.5600000000000005 | I220: 237/522 | J220: F4 | K220: 2020 | L220: 1571
A221: =A220+1 -> 219 | B221: BeamNG | C221: Hirochi | D221: CCF | E221: 270e | F221: 5.73958333333333e-003 | G221: 3.78 | H221: 4.9100000000000001 | I221: 279/383 | J221: FR | K221: 2023 | L221: 1317 | M221: 12.109999999999999 | N221: mod整车/单电机纯电动
A222: =A221+1 -> 220 | B222: Automation | C222: Fenekz | D222: V12 Gen1 | E222: A400 S Hydra Highline | F222: 5.7488425925925901e-003 | G222: 4.14 | H222: 5.04 | I222: 433/539 | J222: F4 | K222: 1985 | L222: 2029 | M222: 12.279999999999999
A223: =A222+1 -> 221 | B223: BeamNG | C223: ETK | D223: S-Series | E223: S6 ttSport+ | F223: 5.7499999999999999e-003 | G223: 4.09 | H223: 5.5999999999999996 | I223: 336/477 | J223: F4 | K223: 2016 | N223: mod整车 | O223: Revamp
A224: =A223+1 -> 222 | B224: BeamNG | C224: Cherrier | D224: FCV | E224: Vivace S 310 Arsenic (DCT) | F224: 5.7534722222222197e-003 | G224: 4.59 | H224: 5.2800000000000002 | I224: 310/403 | J224: FF | K224: 2020 | L224: 1520
A225: =A224+1 -> 223 | B225: Automation | C225: NEXT | D225: Horizon III | E225: 110G Basic | F225: 5.7546296296296304e-003 | G225: 5.19 | H225: 6.75 | I225: 234/383 | J225: FF | K225: 2020 | L225: 1385
A226: =A225+1 -> 224 | B226: BeamNG | C226: Gavril | D226: Vertex NA2 | E226: SUS (A) | F226: 5.7569444444444404e-003 | G226: 3.87 | H226: 5.5300000000000002 | I226: 327/447 | J226: F4 | K226: 2010 | N226: mod整车
A227: =A226+1 -> 225 | B227: BeamNG | C227: Hirochi | D227: Sunburst | E227: 2.2L BR-X HTi [Facelift] (DCT) | F227: 5.75925925925926e-003 | G227: 3.86 | H227: 4.7300000000000004 | I227: 377/413 | J227: F4 | K227: 2014 | N227: mod配置
A228: =A227+1 -> 226 | B228: Automation | C228: Changan | D228: Fns-x | E228: 2020 | F228: 5.7650462962963002e-003 | G228: 4.5999999999999996 | H228: 5.54 | I228: 267/297 | J228: FF | K228: 2020 | L228: 1174
A229: =A228+1 -> 227 | B229: Automation | C229: Visionow | D229: VS06 | E229: 600T | F229: 5.7650462962963002e-003 | G229: 4.82 | H229: 6.7300000000000004 | I229: 284/411 | J229: F4 | K229: 2020
A230: =A229+1 -> 228 | B230: BeamNG | C230: Hirochi | D230: SBR4 | E230: Sahara S (DCT) [Facelift] | F230: 5.76851851851852e-003 | G230: 3.84 | H230: 4.7699999999999996 | I230: 380/400/R4 | J230: R4 | K230: 2013 | N230: mod配置
A231: =A230+1 -> 229 | B231: BeamNG | C231: ETK | D231: S-Series | E231: Sl12x 580 Executive (A) | F231: 5.7696759259259298e-003 | G231: 3.32 | H231: 4.2000000000000002 | I231: 585/765 | J231: F4 | K231: 2016 | L231: 2270 | M231: 11.26 | N231: mod整车 | O231: ETK PACK
A232: =A231+1 -> 230 | B232: BeamNG | C232: ETK | D232: S-Series | E232: Sl8ttx 450 (A) | F232: 5.7708333333333301e-003 | G232: 4.0999999999999996 | H232: 5.2999999999999998 | I232: 451/566 | J232: F4 | K232: 2016 | L232: 2110 | N232: mod整车 | O232: ETK PACK
A233: =A232+1 -> 231 | B233: BeamNG | C233: ETK | D233: 800-Series | E233: 856ttx 310d (A) | F233: 5.7743055555555603e-003 | G233: 3.99 | H233: 5.6900000000000004 | I233: 327/641 | J233: F4 | K233: 2013 | L233: 1694
A234: =A233+1 -> 232 | B234: BeamNG | C234: Cherrier | D234: FCV | E234: Vivace S Gendarmerie (DCT) | F234: 5.7847222222222197e-003 | G234: 4.74 | H234: 5.3700000000000001 | I234: 310/403 | J234: FF | K234: 2020 | L234: 1539
A235: =A234+1 -> 233 | B235: BeamNG | C235: Hirochi | D235: CCF | E235: 5th Anniversary (M) | F235: 5.7974537037036996e-003 | G235: 4.95 | H235: 5.5899999999999999 | I235: 263/270 | J235: FR | K235: 2025 | L235: 1216 | M235: 13.07 | N235: mod整车/解除限速
A236: =A235+1 -> 234 | B236: BeamNG | C236: Hirochi | D236: CCF | E236: 190-4 (DCT) | F236: 5.8252314814814798e-003 | G236: 5.43 | H236: 7.1500000000000004 | I236: 193/240 | J236: FR | K236: 2021 | L236: 1202 | N236: mod整车/解除限速
A237: =A236+1 -> 235 | B237: BeamNG | C237: Civetta | D237: Bolide | E237: 390 GT (M) | F237: 5.8263888888888896e-003 | G237: 3.95 | H237: 5.1600000000000001 | I237: 327/336 | J237: MR | K237: 1981
A238: =A237+1 -> 236 | B238: BeamNG | C238: Civetta | D238: Scintilla | E238: Off-Road (DCT) | F238: 5.8298611111111103e-003 | G238: 3.06 | H238: 3.8599999999999999 | I238: 434/1225 | J238: M4 | K238: 2020 | L238: 1564 | M238: 11.34
A239: =A238+1 -> 237 | B239: BeamNG | C239: ETK | D239: I-Series | E239: 2400tix TTSport Evolution (M) | F239: 5.8310185185185201e-003 | G239: 4.47 | H239: 5.6299999999999999 | I239: 330/436 | J239: F4 | K239: 1987 | L239: 1493 | M239: 12.57
A240: =A239+1 -> 238 | B240: Automation | C240: Fenekz | D240: Continental | E240: V12 | F240: 5.84375e-003 | G240: 5.16 | H240: 7.0899999999999999 | I240: 233/297 | J240: FR | K240: 1960
A241: =A240+1 -> 239 | B241: Automation | C241: Lynk & Co | D241: 00 | E241: 2.0TD | F241: 5.84375e-003 | G241: 4.78 | H241: 7. | I241: 284/411 | J241: F4 | K241: 2020 | N241: 同人作品（非真车） | O241: 300th
A242: =A241+1 -> 240 | B242: BeamNG | C242: ETK | D242: 1300-Series | E242: 1356ttx 310d Driving Experience (A) | F242: 5.8449074074074098e-003 | G242: 4.4900000000000002 | H242: 6.5999999999999996 | I242: 327/641 | J242: F4 | K242: 2015 | L242: 1930 | N242: mod整车
A243: =A242+1 -> 241 | B243: BeamNG | C243: Bruckell | D243: Bastion | E243: eBastion Luxe AWD | F243: 5.8460648148148204e-003 | G243: 4.9000000000000004 | H243: 3.8900000000000001 | I243: 245+407/252+550 | J243: E4(D) | K243: 2016 | L243: 2411 | M243: 12.51 | N243: mod配置/双电机纯电动/解除限速
A244: =A243+1 -> 242 | B244: BeamNG | C244: Procyon | D244: Centauri | E244: Drivable Body and Frame (A) | F244: 5.8483796296296296e-003 | G244: 3.9700000000000002 | H244: 5.0700000000000003 | I244: 456/562 | J244: F4 | K244: 2019 | L244: 2092 | N244: mod整车
A245: =A244+1 -> 243 | B245: BeamNG | C245: ETK | D245: I-Series | E245: 2400ti TTSport Evolution (M) | F245: 5.8541666666666698e-003 | G245: 5.0899999999999999 | H245: 5.5199999999999996 | I245: 330/436 | J245: FR | K245: 1987 | L245: 1469 | M245: 13.210000000000001
A246: =A245+1 -> 244 | B246: Automation | C246: EPEX | D246: L01 | E246: 100e | F246: 5.8599537037036997e-003 | G246: 3.9300000000000002 | H246: 5.2800000000000002 | I246: 330/682 | J246: FF | K246: 2020 | L246: 1371 | N246: 单电机纯电动
A247: =A246+1 -> 245 | B247: Automation | C247: SANDERO | D247: Crossover | E247: 25T4 | F247: 5.8599537037036997e-003 | G247: 5. | H247: 6.1299999999999999 | I247: 301/367 | J247: F4 | K247: 2012
A248: =A247+1 -> 246 | B248: BeamNG | C248: Ibishu | D248: Covet | E248: 2.2 20v Erin edition (M) | F248: 5.8657407407407399e-003 | G248: 4.86 | H248: 6.5599999999999996 | I248: 218/205 | J248: FF | K248: 1986 | L248: 1059 | M248: 13.59 | N248: mod配置
A249: =A248+1 -> 247 | B249: BeamNG | C249: ETK | D249: 1300-Series | E249: 1356ttx 360 (A) | F249: 5.8657407407407399e-003 | G249: 4.36 | H249: 5.8899999999999997 | I249: 367/464 | J249: F4 | K249: 2015 | L249: 1895 | M249: 12.699999999999999 | N249: mod整车
A250: =A249+1 -> 248 | B250: BeamNG | C250: Cherrier | D250: FCV | E250: Vivace S 270 (DCT) | F250: 5.875e-003 | G250: 5.67 | H250: 6.4000000000000004 | I250: 269/350 | J250: FF | K250: 2020 | L250: 1538 | M250: 13.81
A251: =A250+1 -> 249 | B251: BeamNG | C251: ETK | D251: 1300-Series | E251: 1356ttx 340 (A) | F251: 5.875e-003 | G251: 4.43 | H251: 6.0700000000000003 | I251: 346/464 | J251: F4 | K251: 2015 | L251: 1895 | M251: 12.77 | N251: mod整车
A252: =A251+1 -> 250 | B252: BeamNG | C252: Ibishu | D252: Lumiance O32 | E252: GTz AWD (Early/LHD)(M) | F252: 5.8761574074074098e-003 | G252: 4.35 | H252: 5.9800000000000004 | I252: 300/364 | J252: F4 | K252: 1993 | L252: 1425 | M252: 12.68 | N252: mod整车
A253: =A252+1 -> 251 | B253: BeamNG | C253: Cherrier | D253: Rayonner | E253: 340Q (DCT) | F253: 5.8796296296296296e-003 | G253: 5.56 | H253: 6.5700000000000003 | I253: 340/435 | J253: F4 | K253: 2016 | L253: 1994 | M253: 13.640000000000001 | N253: mod整车
A254: =A253+1 -> 252 | B254: Automation | C254: Fenekz | D254: Executive | E254: A350-6 Luxe | F254: 5.8831018518518503e-003 | G254: 4.01 | H254: 5.5999999999999996 | I254: 380/772 | J254: F4 | K254: 2020
A255: =A254+1 -> 253 | B255: BeamNG | C255: Bruckell | D255: Bastion | E255: Luxe 5.7 AWD (A) | F255: 5.8865740740740701e-003 | G255: 4.93 | H255: 6.7300000000000004 | I255: 370/544 | J255: F4 | K255: 2016 | L255: 2058 | M255: 13.01 | N255: 解除限速
A256: =A255+1 -> 254 | B256: Automation | C256: Fenekz | D256: Executive | E256: A400d-8 Luxe Tourer | F256: 5.8877314814814799e-003 | G256: 3.95 | H256: 5.5099999999999998 | I256: 458/986 | J256: F4 | K256: 2020 | N256: 解除限速
A257: =A256+1 -> 255 | B257: BeamNG | C257: ETK | D257: 700-Series | E257: 744 250x (A) | F257: 5.8981481481481498e-003 | G257: 4.7000000000000002 | H257: 6.9000000000000004 | I257: 252/362 | J257: F4 | K257: 2005 | N257: mod整车
A258: =A257+1 -> 256 | B258: BeamNG | C258: ETK | D258: 800-Series | E258: 856xc 300 (A) | F258: 5.90625e-003 | G258: 4.33 | H258: 6.0599999999999996 | I258: 305/407 | J258: F4 | K258: 2013
A259: =A258+1 -> 257 | B259: Automation | C259: Geely LEVC | D259: Aberdeen | E259: 2.0TD | F259: 5.9085648148148101e-003 | G259: 4.82 | H259: 7.0300000000000002 | I259: 284/411 | J259: F4 | K259: 2020 | N259: 同人作品（非真车）
A260: =A259+1 -> 258 | B260: Automation | C260: Fenekz | D260: Ute One-Tonner | E260: LS2 AWD | F260: 5.9108796296296296e-003 | G260: 3.99 | H260: 5.0700000000000003 | I260: 379/511 | J260: F4 | K260: 2020 | L260: 1647 | M260: 12.19
A261: =A260+1 -> 259 | B261: Automation | C261: Fenekz | D261: Executive | E261: A400d-8 Luxe Cross Tourer | F261: 5.9166666666666699e-003 | G261: 4.11 | H261: 5.6299999999999999 | I261: 458/986 | J261: F4 | K261: 2020 | L261: 2646 | M261: 12.48
A262: =A261+1 -> 260 | B262: Automation | C262: Fenekz | D262: Continental | E262: V12-380 | F262: 5.9201388888888897e-003 | G262: 4.45 | H262: 5.5999999999999996 | I262: 380/524 | J262: F4 | K262: 1990 | L262: 1796
A263: =A262+1 -> 261 | B263: BeamNG | C263: Cherrier | D263: Rayonner | E263: 340Q (A) | F263: 5.9212962962963004e-003 | G263: 4.67 | H263: 6.7400000000000002 | I263: 340/435 | J263: F4 | K263: 2016 | N263: mod整车
A264: =A263+1 -> 262 | B264: Automation | C264: Fenekz | D264: Verve II | E264: 200 Ts Highline | F264: 5.92592592592593e-003 | G264: 5.54 | H264: 8.0299999999999994 | I264: 200/306 | J264: FF | K264: 2020
A265: =A264+1 -> 263 | B265: Automation | C265: Fenekz | D265: Everest | E265: A300 V6 | F265: 5.9270833333333302e-003 | G265: 5.08 | H265: 7.2699999999999996 | I265: 300/451 | J265: F4 | K265: 2020
A266: =A265+1 -> 264 | B266: BeamNG | C266: ETK | D266: S-Series | E266: Ss6ttx 310d (A) | F266: 5.9305555555555596e-003 | G266: 4.84 | H266: 7.0300000000000002 | I266: 327/641 | J266: F4 | K266: 2016 | L266: 2048 | N266: mod整车 | O266: ETK PACK
A267: =A266+1 -> 265 | B267: BeamNG | C267: Hirochi | D267: SBR4 | E267: RWD Base (DCT) | F267: 5.9351851851851796e-003 | G267: 5.47 | H267: 7.9900000000000002 | I267: 210/259 | J267: RR | K267: 2013
A268: =A267+1 -> 266 | B268: BeamNG | C268: Cherrier | D268: FCV | E268: Vivace 230S (DCT) | F268: 5.9537037037036998e-003 | G268: 5.21 | H268: 7.0599999999999996 | I268: 230/357 | J268: FF | K268: 2020 | L268: 1493
A269: =A268+1 -> 267 | B269: Automation | C269: ADVENTURE | D269: Crisser | E269: circuit | F269: 5.9606481481481498e-003 | G269: 5.26 | H269: 7.2999999999999998 | I269: 198/216 | J269: F4 | K269: 2012
A270: =A269+1 -> 268 | B270: BeamNG | C270: Ibishu | D270: Covet | E270: MR Turbo Evolution (M) | F270: 5.9652777777777803e-003 | G270: 4.53 | H270: 7. | I270: 223/262 | J270: MR | K270: 1987
A271: =A270+1 -> 269 | B271: Automation | C271: Fenekz | D271: Enterprise III | E271: 500x | F271: 5.9699074074074099e-003 | G271: 4.25 | H271: 5.71 | I271: 530/880 | J271: F4 | K271: 2020 | L271: 2860
A272: =A271+1 -> 270 | B272: BeamNG | C272: Civetta | D272: Bolide | E272: 350 (M) | F272: 5.9710648148148101e-003 | G272: 4.79 | H272: 6.4299999999999997 | I272: 264/315 | J272: MR | K272: 1981 | L272: 1366
A273: =A272+1 -> 271 | B273: Automation | C273: Lanser | D273: R290 | E273: _ | F273: 5.9733796296296297e-003 | G273: 4.42 | H273: 4.9699999999999998 | I273: 281/432 | J273: FF | K273: 2020 | L273: 1195
A274: =A273+1 -> 272 | B274: Automation | C274: Fenekz | D274: Everest | E274: 400 V6 S | F274: 5.9803240740740702e-003 | G274: 4.57 | H274: 6.3200000000000003 | I274: 400/672 | J274: F4 | K274: 2020
A275: =A274+1 -> 273 | B275: BeamNG | C275: Ibishu | D275: BX-Series | E275: Hecate GTS Type-S (M) | F275: 5.9872685185185202e-003 | G275: 4.8200000000000003 | H275: 7.2599999999999998 | I275: 250/385 | J275: FR | K275: 1990 | L275: 1457 | N275: mod车身
A276: =A275+1 -> 274 | B276: BeamNG | C276: Gavril | D276: Vertex NA2 | E276: V220 Sport (DCT) | F276: 6.0046296296296297e-003 | G276: 5.5999999999999996 | H276: 8.1099999999999994 | I276: 220/298 | J276: FF | K276: 2010 | L276: 1405 | N276: mod整车
A277: =A276+1 -> 275 | B277: Automation | C277: OLDSMOTOR | D277: ICHNE LQM | E277: 2.0T DCT GT-K | F277: 6.0081018518518504e-003 | G277: 6.06 | H277: 9.2300000000000004 | I277: 215/376 | J277: F4 | K277: 2020 | L277: 1645 | M277: 14.19
A278: =A277+1 -> 276 | B278: Automation | C278: Fenekz | D278: V12 Gen1 | E278: A340 Hydra Highline Coupe | F278: 6.01041666666667e-003 | G278: 5.13 | H278: 5.7000000000000002 | I278: 340/496 | J278: F4 | K278: 1985 | L278: 1826 | M278: 13.130000000000001 | N278: 解除限速
A279: =A278+1 -> 277 | B279: BeamNG | C279: Ibishu | D279: Pessima I | E279: 2.0 SE SR-TECNICA (M) | F279: 6.0115740740740737e-003 | G279: 5.66 | H279: 7.1600000000000001 | I279: 230/208 | J279: FF | K279: 1988 | L279: 1267 | M279: 13.93 | N279: mod车身
A280: =A279+1 -> 278 | B280: Automation | C280: Currus | D280: 500-X | E280: XSE-6 i-AWD+ | F280: 6.0173611111111096e-003 | G280: 3.64 | H280: 5.0999999999999996 | I280: 428/577 | J280: F4 | K280: 2020
A281: =A280+1 -> 279 | B281: Automation | C281: Fenekz | D281: Enterprise II XL | E281: A700 Pushrod | F281: 6.0185185185185203e-003 | G281: 3.29 | H281: 4.1299999999999999 | I281: 718/1631 | J281: F4 | K281: 2020 | L281: 3125
A282: =A281+1 -> 280 | B282: Automation | C282: ABTC | D282: RCM | E282: S2614 | F282: 6.0196759259259301e-003 | G282: 5.77 | H282: 8. | I282: 207/292 | J282: FF | K282: 2020 | L282: 1408
A283: =A282+1 -> 281 | B283: BeamNG | C283: ETK | D283: 800-Series | E283: 854x 250 (A) | F283: 6.0231481481481499e-003 | G283: 4.9900000000000002 | H283: 7.2999999999999998 | I283: 252/362 | J283: F4 | K283: 2013
A284: =A283+1 -> 282 | B284: BeamNG | C284: Hirochi | D284: Sunburst | E284: 2.0 Sport S AWD (DCT) | F284: 6.0231481481481499e-003 | G284: 5. | H284: 7.4699999999999998 | I284: 223/303 | J284: F4 | K284: 2009
A285: =A284+1 -> 283 | B285: Automation | C285: Fenekz | D285: Oasis | E285: 200 Tech | F285: 6.0381944444444398e-003 | G285: 6.0499999999999998 | H285: 8.6899999999999995 | I285: 216/352 | J285: FF | K285: 2020
A286: =A285+1 -> 284 | B286: Automation | C286: Fenekz | D286: Bussiness Gen2 | E286: A500 Direct Vier | F286: 6.04166666666667e-003 | G286: 5.06 | H286: 4.7199999999999998 | I286: 391+155/688+201 | J286: F4 | K286: 2020 | N286: 发动机直驱+单P3电机辅助
A287: =A286+1 -> 285 | B287: Automation | C287: Fenekz | D287: Hydra | E287: 25V6-260 GT Turbo | F287: 6.0462962962962996e-003 | G287: 5.23 | H287: 6.9500000000000002 | I287: 257/326 | J287: FF | K287: 1990
A288: =A287+1 -> 286 | B288: BeamNG | C288: Ibishu | D288: Pessima II | E288: 3.0 LX V6 Sport Miami (M) | F288: 6.0474537037036999e-003 | G288: 6.4699999999999998 | H288: 7.54 | I288: 233/283 | J288: FF | K288: 1996 | L288: 1445 | N288: mod配置
A289: =A288+1 -> 287 | B289: Automation | C289: Fenekz | D289: Tempest | E289: 200 Luxe | F289: 6.0648148148148102e-003 | G289: 6.2800000000000002 | H289: 9.8800000000000008 | I289: 202/361 | J289: FR | K289: 2020 | L289: 1585
A290: =A289+1 -> 288 | B290: BeamNG | C290: Ibishu | D290: Pessima II | E290: 2.4 XG-S SR-TECNICA (JDM-M) | F290: 6.07291666666667e-003 | G290: 5.5 | H290: 7.5700000000000003 | I290: 226/227 | J290: FF | K290: 1996 | L290: 1391 | N290: mod配置
A291: =A290+1 -> 289 | B291: Automation | C291: Fenekz | D291: Ute One-Tonner | E291: 2.0 TD-240 AWD | F291: 6.0752314814814801e-003 | G291: 4.9400000000000004 | H291: 7.2699999999999996 | I291: 245/502 | J291: F4 | K291: 2020
A292: =A291+1 -> 290 | B292: BeamNG | C292: Ibishu | D292: BX-Series | E292: Diana GTz25-T (M) | F292: 6.08796296296296e-003 | G292: 4.5300000000000002 | H292: 6.7999999999999998 | I292: 249/383 | J292: FR | K292: 1990 | N292: mod配置/解除限速
A293: =A292+1 -> 291 | B293: BeamNG | C293: ETK | D293: 800-Series | E293: 854 Polizei (A) | F293: 6.0891203703703697e-003 | G293: 5.5 | H293: 8.4700000000000006 | I293: 233/452 | J293: F4 | K293: 2013
A294: =A293+1 -> 292 | B294: BeamNG | C294: Procyon | D294: Centauri | E294: S520T (A) | F294: 6.0902777777777804e-003 | G294: 4.11 | H294: 5.7400000000000002 | I294: 549/747 | J294: F4 | K294: 2023 | L294: 2732 | N294: mod整车
A295: =A294+1 -> 293 | B295: BeamNG | C295: ETK | D295: K-Series | E295: Kc4 190 (A) | F295: 6.0914351851851798e-003 | G295: 6.06 | H295: 8.5700000000000003 | I295: 201/286 | J295: FR | K295: 2015 | L295: 1509 | N295: mod配置
A296: =A295+1 -> 294 | B296: BeamNG | C296: Arima | D296: CS200 Platform | E296: Monica ELDY 2000 Tourer AWD Wonderland (M) | F296: 6.0995370370370396e-003 | G296: 4.92 | H296: 6.96 | I296: 243/293 | J296: F4 | K296: 1992 | L296: 1366 | M296: 13.18 | N296: mod整车
A297: =A296+1 -> 295 | B297: Automation | C297: Fenekz | D297: Enterprise III | E297: 330xd S50 | F297: 6.1006944444444502e-003 | G297: 5.5999999999999996 | H297: 8.5700000000000003 | I297: 374/890 | J297: F4 | K297: 2020 | L297: 2864
A298: =A297+1 -> 296 | B298: BeamNG | C298: Ibishu | D298: Pessima II | E298: 2.7 LX V6 Sport GTz (M) | F298: 6.1053240740740703e-003 | G298: 5.9000000000000004 | H298: 8.8300000000000001 | I298: 193/251 | J298: FF | K298: 1996 | L298: 1317
A299: =A298+1 -> 297 | B299: Automation | C299: Fenekz | D299: V12 Gen1 | E299: A550 V16 Whale | F299: 6.1145833333333304e-003 | G299: 3.92 | H299: 4.4699999999999998 | I299: 551/862 | J299: F4 | K299: 1985
A300: =A299+1 -> 298 | B300: BeamNG | C300: ETK | D300: I-Series | E300: 3000ix AC Stuttgaria (M) | F300: 6.1273148148148103e-003 | G300: 5.7000000000000002 | H300: 8.5600000000000005 | I300: 244/330 | J300: F4 | K300: 1987 | N300: mod配置
A301: =A300+1 -> 299 | B301: Automation | C301: Fenekz | D301: V12 Gen3 | E301: A700 Luxe-Protect | F301: 6.1296296296296298e-003 | G301: 5.59 | H301: 6.9699999999999998 | I301: 707/1237 | J301: F4 | K301: 2020 | L301: 5352
A302: =A301+1 -> 300 | B302: BeamNG | C302: Ibishu | D302: BX-Series | E302: V-Special GTz Turbo (M) | F302: 6.1331018518518497e-003 | G302: 5.13 | H302: 7.7000000000000002 | I302: 215/281 | J302: FR | K302: 1990 | L302: 1295
A303: =A302+1 -> 301 | B303: BeamNG | C303: Hirochi | D303: Ute | E303: Hirochi 120 Street Tuned (M) (4H) | F303: 6.1377314814814801e-003 | G303: 6.55 | H303: 7.71 | I303: 212/182 | J303: F4 | K303: 1982 | L303: 1196 | N303: mod整车/高性能散热器 | O303: 转子
A304: =A303+1 -> 302 | B304: BeamNG | C304: Bruckell | D304: Bastion | E304: eBastion | F304: 6.1377314814814801e-003 | G304: 5.96 | H304: 6.0700000000000003 | I304: 407/550 | J304: RR | K304: 2016 | L304: 2058 | M304: 13.9 | N304: mod配置/单电机纯电动
A305: =A304+1 -> 303 | B305: Automation | C305: Toyota | D305: HiACE | E305: Crown Edition | F305: 6.1388888888888899e-003 | G305: 6.47 | H305: 7.7300000000000004 | I305: 354/458 | J305: F4 | K305: 2020 | N305: 同人作品（非真车）
A306: =A305+1 -> 304 | B306: Automation | C306: Fenekz | D306: V12 Gen1 | E306: A340 Hydra Base Touring | F306: 6.15740740740741e-003 | G306: 5.63 | H306: 6.3300000000000001 | I306: 340/496 | J306: F4 | K306: 1985
A307: =A306+1 -> 305 | B307: BeamNG | C307: AW | D307: Astro | E307: 1.8 Special (M) | F307: 6.1631944444444399e-003 | G307: 5.57 | H307: 8.6699999999999999 | I307: 166/216 | J307: F4 | K307: 1980
A308: =A307+1 -> 306 | B308: BeamNG | C308: Cherrier | D308: FCV | E308: Vivace 190Sd (DCT) | F308: 6.1747685185185204e-003 | G308: 5.87 | H308: 9.1099999999999994 | I308: 195/405 | J308: FF | K308: 2020
A309: =A308+1 -> 307 | B309: BeamNG | C309: Ibishu | D309: BX-Series | E309: 200BX GTz Turbo (M) | F309: 6.1759259259259302e-003 | G309: 5.02 | H309: 7.5300000000000002 | I309: 215/281 | J309: FR | K309: 1990 | L309: 1284
A310: =A309+1 -> 308 | B310: BeamNG | C310: Ibishu | D310: Pessima II | E310: 3.0 EX V6 (M) | F310: 6.17939814814815e-003 | G310: 6.74 | H310: 8.3000000000000007 | I310: 219/274 | J310: FF | K310: 1996 | L310: 1430 | N310: mod配置
A311: =A310+1 -> 309 | B311: BeamNG | C311: Hirochi | D311: Sunburst | E311: Sun-E 250 Dual Performance | F311: 6.1840277777777796e-003 | G311: 4.67 | H311: 6.8700000000000001 | I311: 182+144/230+171 | J311: E4(D) | K311: 2016 | L311: 1650 | M311: 13.029999999999999 | N311: mod配置/双电机纯电动
A312: =A311+1 -> 310 | B312: BeamNG | C312: Ibishu | D312: Pessima II | E312: 2.0 V6 Touring-R SR-TEC Fultrac (JDM-M) | F312: 6.1967592592592604e-003 | G312: 6.57 | H312: 9.2300000000000004 | I312: 217/209 | J312: F4 | K312: 1996 | N312: mod配置
A313: =A312+1 -> 311 | B313: BeamNG | C313: Ibishu | D313: Pessima II | E313: 2.7 LX V6 Sport (A) | F313: 6.1979166666666701e-003 | G313: 6.17 | H313: 9.2300000000000004 | I313: 193/251 | J313: FF | K313: 1996 | L313: 1313
A314: =A313+1 -> 312 | B314: BeamNG | C314: Ibishu | D314: Pessima I | E314: 2.0 GTz (M) | F314: 6.2025462962962997e-003 | G314: 5.46 | H314: 8.2200000000000006 | I314: 233/270 | J314: F4 | K314: 1988 | L314: 1375
A315: =A314+1 -> 313 | B315: BeamNG | C315: Gavril | D315: Grand Marshal | E315: V8 RoadSport (A) | F315: 6.2060185185185204e-003 | G315: 5.28 | H315: 7.8300000000000001 | I315: 302/566 | J315: FR | K315: 1995
A316: =A315+1 -> 314 | B316: BeamNG | C316: ETK | D316: 800-Series | E316: 854d 190 (A) | F316: 6.2071759259259302e-003 | G316: 6.16 | H316: 9.9299999999999997 | I316: 193/405 | J316: FR | K316: 2013
A317: =A316+1 -> 315 | B317: BeamNG | C317: Gavril | D317: Barstow | E317: Kingsnake (M) | F317: 6.2118055555555598e-003 | G317: 5.19 | H317: 6. | I317: 345/705 | J317: FR | K317: 1969 | L317: 1710 | M317: 13.390000000000001
A318: =A317+1 -> 316 | B318: Automation | C318: IND | D318: F2 Classic | E318: 1.8TE S GT-K | F318: 6.2129629629629601e-003 | G318: 4.51 | H318: 8.8300000000000001 | I318: 157+132/244+149 | J318: FF | K318: 2020 | N318: 单P3电机混动
A319: =A318+1 -> 317 | B319: Automation | C319: Fenekz | D319: Protector | E319: A400-6 | F319: 6.2233796296296299e-003 | G319: 3.73 | H319: 5.2000000000000002 | I319: 436/707 | J319: F4 | K319: 2020
A320: =A319+1 -> 318 | B320: BeamNG | C320: ETK | D320: K1 | E320: 2.5 (M) | F320: 6.2233796296296299e-003 | G320: 6.33 | H320: 9.7300000000000004 | I320: 170/222 | J320: FR | K320: 1989 | L320: 1209 | N320: mod整车
A321: =A320+1 -> 319 | B321: BeamNG | C321: Ibishu | D321: Lumiance O32 | E321: ZX AWD (Early/LHD)(M) | F321: 6.22569444444444e-003 | G321: 6.15 | H321: 9.2699999999999996 | I321: 202/262 | J321: F4 | K321: 1992 | L321: 1426 | N321: mod整车
A322: =A321+1 -> 320 | B322: BeamNG | C322: Ibishu | D322: CrossSport | E322: 2.7 GTz (North America) (M) | F322: 6.2268518518518497e-003 | G322: 4.66 | H322: 6.8899999999999997 | I322: 318/433 | J322: F4 | K322: 2006 | L322: 1532 | N322: mod整车
A323: =A322+1 -> 321 | B323: Automation | C323: Fenekz | D323: Enterprise III | E323: 350x | F323: 6.2280092592592604e-003 | G323: 5.52 | H323: 8.1199999999999992 | I323: 394/746 | J323: F4 | K323: 2020 | L323: 2844
A324: =A323+1 -> 322 | B324: BeamNG | C324: AW | D324: Bete | E324: LTCC 1987 | F324: 6.2280092592592604e-003 | G324: 4.86 | H324: 5.2999999999999998 | I324: 228/221 | J324: FF | K324: 1987 | N324: mod整车/赛车
A325: =A324+1 -> 323 | B325: Automation | C325: Visionow | D325: VS3 | E325: 300 Touring 2025 | F325: 6.2314814814814802e-003 | G325: 7.3399999999999999 | H325: 11.109999999999999 | I325: 184/349 | J325: FF | K325: 2020
A326: =A325+1 -> 324 | B326: BeamNG | C326: Procyon | D326: Centauri | E326: L520T Nebula Edition | F326: 6.2337962962962998e-003 | G326: 4.06 | H326: 5.6299999999999999 | I326: 549/747 | J326: F4 | K326: 2023 | N326: mod整车
A327: =A326+1 -> 325 | B327: BeamNG | C327: Bruckell | D327: Moonhawk | E327: 378 Custom Turbodiesel (A) | F327: 6.2523148148148199e-003 | G327: 4.73 | H327: 6.3600000000000003 | I327: 376/782 | J327: FR | K327: 1973 | L327: 1767 | N327: mod配置
A328: =A327+1 -> 326 | B328: BeamNG | C328: Cherrier | D328: Rayonner | E328: Carabinieri (A) | F328: 6.2650462962962998e-003 | G328: 6.24 | H328: 10.27 | I328: 270/337 | J328: F4 | K328: 2016 | N328: mod整车
A329: =A328+1 -> 327 | B329: BeamNG | C329: Gavril | D329: Barstow | E329: Lancehead (M) | F329: 6.2673611111111098e-003 | G329: 5.77 | H329: 7.8899999999999997 | I329: 269/533 | J329: FR | K329: 1969 | L329: 1696 | M329: 13.99
A330: =A329+1 -> 328 | B330: Automation | C330: IND | D330: MAX9 AVP | E330: 4.0TE LR [FL2] | F330: 6.2696759259259303e-003 | G330: 3.1000000000000001 | H330: 4.0099999999999998 | I330: 492+201+281/684+220+300 | J330: F4 | K330: 2020 | N330: 双P3电机混动
A331: =A330+1 -> 329 | B331: BeamNG | C331: ETK | D331: S-Series | E331: S4t (A) | F331: 6.2731481481481501e-003 | G331: 6.9699999999999998 | H331: 10.42 | I331: 183/299 | J331: FR | K331: 2016 | N331: mod整车 | O331: Revamp
A332: =A331+1 -> 330 | B332: BeamNG | C332: ETK | D332: I-Series | E332: 2400tix TTSport (Facelift,M) | F332: 6.2812500000000004e-003 | G332: 6.5 | H332: 10.130000000000001 | I332: 207/292 | J332: F4 | K332: 1990 | L332: 1477
A333: =A332+1 -> 331 | B333: BeamNG | C333: Cherrier | D333: FCV | E333: Tograq 190dq (DCT) | F333: 6.2824074074074102e-003 | G333: 6.13 | H333: 11.06 | I333: 192/402 | J333: F4 | K333: 2020 | L333: 1656
A334: =A333+1 -> 332 | B334: BeamNG | C334: Cherrier | D334: FCV | E334: Tograq qE | F334: 6.2835648148148104e-003 | G334: 5.0999999999999996 | H334: 6.2300000000000004 | I334: 197+170/340+201 | J334: E4(D) | K334: 2020 | L334: 1952 | M334: 13.35 | N334: 双电机纯电动/解除限速
A335: =A334+1 -> 333 | B335: BeamNG | C335: Ibishu | D335: Pessima Zenith II | E335: 2000 Touring-R SR-TEC (A) | F335: 6.2835648148148104e-003 | G335: 7.27 | H335: 9.4499999999999993 | I335: 202/206 | J335: F4 | K335: 1994 | N335: mod整车
A336: =A335+1 -> 334 | B336: BeamNG | C336: Ibishu | D336: Pessima Zenith I | E336: 2000 Luminaire-Vi-TURBO Coupe (A) | F336: 6.28587962962963e-003 | G336: 6.66 | H336: 8.2599999999999998 | I336: 209/258 | J336: F4 | K336: 1984 | L336: 1304 | N336: mod整车
A337: =A336+1 -> 335 | B337: BeamNG | C337: Ibishu | D337: Covet | E337: 15GTz Turbo (M) | F337: 6.2881944444444443e-003 | G337: 6.43 | H337: 9.5999999999999996 | I337: 152/197 | J337: FF | K337: 1986 | L337: 1048 | M337: 14.75
A338: =A337+1 -> 336 | B338: BeamNG | C338: Ibishu | D338: Pessima II | E338: 2.7 LX V6 GX-RV Redwood (A) | F338: 6.28819444444444e-003 | G338: 5.7000000000000002 | H338: 8.1300000000000008 | I338: 247/322 | J338: F4 | K338: 1996 | L338: 1467 | N338: mod配置
A339: =A338+1 -> 337 | B339: BeamNG | C339: Hirochi | D339: Ute | E339: Hirochi RUSH XL Turbo HTi (M)(4H) | F339: 6.2905092592592596e-003 | G339: 6.96 | H339: 9.5999999999999996 | I339: 148/186 | J339: F4 | K339: 1982 | L339: 1208 | N339: mod整车
A340: =A339+1 -> 338 | B340: BeamNG | C340: Procyon | D340: Centauri | E340: S410T (A) | F340: 6.2905092592592596e-003 | G340: 4.91 | H340: 7.1399999999999997 | I340: 443/549 | J340: F4 | K340: 2022 | N340: mod整车
A341: =A340+1 -> 339 | B341: BeamNG | C341: SP | D341: Rockbasher | E341: Rock Bouncer (A) (4H) | F341: 6.2986111111111099e-003 | G341: 4.38 | H341: 6.6900000000000004 | I341: 456/599 | J341: M4 | K341: 2008 | L341: 1859 | N341: 赛车
A342: =A341+1 -> 340 | B342: BeamNG | C342: Ibishu | D342: BX-Series | E342: Diana GT25-T (M) | F342: 6.2997685185185196e-003 | G342: 4.56 | H342: 6.7000000000000002 | I342: 248/383 | J342: FR | K342: 1990 | N342: mod配置/解除限速
A343: =A342+1 -> 341 | B343: Automation | C343: Visionow | D343: VS06 | E343: 600E | F343: 6.3159722222222202e-003 | G343: 5.86 | H343: 9.0600000000000005 | I343: 153+231/249+376 | J343: E4(D) | K343: 2020 | N343: 双电机纯电动
A344: =A343+1 -> 342 | B344: Automation | C344: IND | D344: A1 AVP | E344: 1.8TE GT-K | F344: 6.3310185185185197e-003 | G344: 4.61 | H344: 11.6 | I344: 157+73+113/244+74+119 | J344: F4 | K344: 2020 | N344: 双P3电机混动
A345: =A344+1 -> 343 | B345: BeamNG | C345: Bruckell | D345: LeGran | E345: 1.8 Turbo Evoluzione (M) | F345: 6.3414351851851904e-003 | G345: 6.9400000000000004 | H345: 11.27 | I345: 170/223 | J345: FF | K345: 1987 | N345: mod配置
A346: =A345+1 -> 344 | B346: Automation | C346: Fenekz | D346: Verve II | E346: 190xd Cross Highline | F346: 6.3449074074074102e-003 | G346: 6. | H346: 9.8300000000000001 | I346: 185/391 | J346: F4 | K346: 2020
A347: =A346+1 -> 345 | B347: Automation | C347: IND | D347: NEX5 | E347: 2.0TE S [FL2] | F347: 6.3472222222222202e-003 | G347: 5.6699999999999999 | H347: 5.5 | I347: 158+164+51/325+250+92 | J347: FIRE | K347: 2020 | N347: 发动机直驱+单P3电机辅助+单P4电机
A348: =A347+1 -> 346 | B348: BeamNG | C348: Ibishu | D348: Pessima Zenith I | E348: 2000 Luminaire-Vi-TURBO 50th Anniv. (M) | F348: 6.3472222222222202e-003 | G348: 6.9000000000000004 | H348: 8.5700000000000003 | I348: 209/258 | J348: F4 | K348: 1986 | L348: 1351 | M348: 14.869999999999999 | N348: mod整车
A349: =A348+1 -> 347 | B349: BeamNG | C349: Ibishu | D349: CrossSport | E349: 2.3 GTz [EUDM] (M) | F349: 6.3495370370370398e-003 | G349: 5.0599999999999996 | H349: 8.1899999999999995 | I349: 277/344 | J349: F4 | K349: 2006 | L349: 1517 | N349: mod整车
A350: =A349+1 -> 348 | B350: BeamNG | C350: ETK | D350: I-Series | E350: 3000i (M) Facelift | F350: 6.3692129629629602e-003 | G350: 6.0599999999999996 | H350: 9.6699999999999999 | I350: 202/297 | J350: FR | K350: 1990 | L350: 1445
A351: =A350+1 -> 349 | B351: BeamNG | C351: Ibishu | D351: Covet | E351: 15GT-z Turbo Fultrac (Early-M) | F351: 6.37037037037037e-003 | G351: 6.0300000000000002 | H351: 10.960000000000001 | I351: 152/197 | J351: F4 | K351: 1986 | N351: mod配置
A352: =A351+1 -> 350 | B352: BeamNG | C352: ETK | D352: I-Series | E352: 3000xi (A) Facelift | F352: 6.3749999999999996e-003 | G352: 7.2999999999999998 | H352: 10.890000000000001 | I352: 202/297 | J352: F4 | K352: 1990 | L352: 1469
A353: =A352+1 -> 351 | B353: BeamNG | C353: Ibishu | D353: CrossSport | E353: 2.0 GTz (Japan) (M) | F353: 6.3761574074074102e-003 | G353: 5.3300000000000001 | H353: 8.8300000000000001 | I353: 265/331 | J353: F4 | K353: 2006 | L353: 1519 | N353: mod整车
A354: =A353+1 -> 352 | B354: BeamNG | C354: Soliad | D354: Wendover | E354: Sport SE 4400 V8 (Facelift) (A) | F354: 6.3796296296296301e-003 | G354: 6.0899999999999999 | H354: 9.5999999999999996 | I354: 255/469 | J354: FF | K354: 1992
A355: =A354+1 -> 353 | B355: BeamNG | C355: Cherrier | D355: FCV | E355: Vivace 160 (DCT) | F355: 6.3877314814814803e-003 | G355: 6.9000000000000004 | H355: 11.31 | I355: 163/262 | J355: FF | K355: 2020 | L355: 1496
A356: =A355+1 -> 354 | B356: BeamNG | C356: Bruckell | D356: LeGran | E356: Black Edition V8 Digital (Facelift) (A) | F356: 6.3912037037037002e-003 | G356: 5.5599999999999996 | H356: 8.6300000000000008 | I356: 255/469 | J356: F4 | K356: 1989 | N356: mod配置
A357: =A356+1 -> 355 | B357: BeamNG | C357: ETK | D357: K-Series | E357: Kr6 (A) | F357: 6.3912037037037002e-003 | G357: 7.8700000000000001 | H357: 12.460000000000001 | I357: 163/227 | J357: FR | K357: 1994 | L357: 1408 | N357: mod整车
A358: =A357+1 -> 356 | B358: BeamNG | C358: Bruckell | D358: Bastion | E358: Taxi (A) | F358: 6.40393518518518e-003 | G358: 6.2400000000000002 | H358: 8.4700000000000006 | I358: 284/362 | J358: FR | K358: 2016 | N358: 解除限速
A359: =A358+1 -> 357 | B359: BeamNG | C359: Brutto | D359: Grander | E359: (Facelifted 3rd Gen) SE V8 4WD (M) | F359: 6.4085648148148201e-003 | G359: 4.7999999999999998 | H359: 6.7000000000000002 | I359: 325/466 | J359: F4 | K359: 2004 | L359: 1572 | M359: 13.1 | N359: mod整车
A360: =A359+1 -> 358 | B360: BeamNG | C360: ETK | D360: I-Series | E360: 2400ti TTSport (M) | F360: 6.4097222222222203e-003 | G360: 6.2599999999999998 | H360: 9.7400000000000002 | I360: 207/292 | J360: FR | K360: 1985 | L360: 1453
A361: =A360+1 -> 359 | B361: BeamNG | C361: Ibishu | D361: Pessima Zenith I | E361: 1800 Touring-Li-TURBO (A) | F361: 6.4189814814814804e-003 | G361: 7.0700000000000003 | H361: 10.279999999999999 | I361: 182/240 | J361: F4 | K361: 1984 | N361: mod整车
A362: =A361+1 -> 360 | B362: Automation | C362: Fenekz | D362: Hydra | E362: 30V6-320 Turbo Sahara | F362: 4.80856481481481e-002 | G362: 4.2599999999999998 | H362: 5.7599999999999998 | I362: 315/523 | J362: F4 | K362: 1990
A363: =A362+1 -> 361 | B363: Automation | C363: Fenekz | D363: Enterprise III | E363: 300xd | F363: 6.4259259259259304e-003 | G363: 6.6299999999999999 | H363: 10.470000000000001 | I363: 313/790 | J363: F4 | K363: 2020 | L363: 2847
A364: =A363+1 -> 362 | B364: BeamNG | C364: Gavril | D364: Bandit | E364: 464 V8 RoadSport Package (M) | F364: 6.4293981481481502e-003 | G364: 5.7699999999999996 | H364: 8.2300000000000004 | I364: 266/524 | J364: FR | K364: 1972 | L364: 1704 | N364: mod整车
A365: =A364+1 -> 363 | B365: BeamNG | C365: AW | D365: Bete | E365: 1.3 C40 (M) | F365: 6.43055555555556e-003 | G365: 6.4400000000000004 | H365: 11.84 | I365: 116/148 | J365: FF | K365: 1991 | L365: 808 | N365: mod整车
A366: =A365+1 -> 364 | B366: BeamNG | C366: Cherrier | D366: FCV | E366: Vivace 160 Wagon (DCT) | F366: 6.4317129629629603e-003 | G366: 7.2599999999999998 | H366: 11.41 | I366: 163/262 | J366: FF | K366: 2020 | L366: 1521 | N366: mod车身
A367: =A366+1 -> 365 | B367: Automation | C367: Fenekz | D367: Executive | E367: R190 TDi Base | F367: 6.4374999999999996e-003 | G367: 7.5 | H367: 12.630000000000001 | I367: 185/391 | J367: FR | K367: 2020
A368: =A367+1 -> 366 | B368: BeamNG | C368: Ibishu | D368: BX-Series | E368: 200BX Type-LS (M) | F368: 6.4386574074074103e-003 | G368: 7.0999999999999996 | H368: 11.470000000000001 | I368: 163/188 | J368: FR | K368: 1990
A369: =A368+1 -> 367 | B369: BeamNG | C369: Ibishu | D369: 200BX (Before v0.32) | E369: Type-LS (M) | F369: 6.4432870370370399e-003 | G369: 7.2999999999999998 | H369: 12.76 | I369: 149/182 | J369: FR | K369: 1990
A370: =A369+1 -> 368 | B370: BeamNG | C370: Bruckell | D370: Bastion | E370: SE 3.5 | F370: 6.4502314814814804e-003 | G370: 6.23 | H370: 8.6699999999999999 | I370: 284/362 | J370: FR | K370: 2016
A371: =A370+1 -> 369 | B371: BeamNG | C371: Cherrier | D371: Rayonner | E371: 250d (A) | F371: 6.4525462962963e-003 | G371: 5.73 | H371: 9.0700000000000003 | I371: 250/537 | J371: FR | K371: 2016 | N371: mod整车
A372: =A371+1 -> 370 | B372: Automation | C372: Currus | D372: 320 | E372: T6 Cross X | F372: 6.4629629629629603e-003 | G372: 6.93 | H372: 11.27 | I372: 189/229 | J372: F4 | K372: 2020
A373: =A372+1 -> 371 | B373: BeamNG | C373: TAZ | D373: Baikal | E373: Electric Conversion | F373: 6.47685185185185e-003 | G373: 5.47 | H373: 5.46 | I373: 158+246/149+200 | J373: E4(D) | K373: 1981 | L373: 1590 | M373: 13.44 | N373: mod整车/双电机纯电动/解除限速
A374: =A373+1 -> 372 | B374: BeamNG | C374: ETK | D374: 800-Series | E374: 854 150d (A) | F374: 6.4849537037037002e-003 | G374: 7.67 | H374: 13.4 | I374: 153/322 | J374: FR | K374: 2013
A375: =A374+1 -> 373 | B375: BeamNG | C375: Ibishu | D375: BX-Series | E375: Diana GT25 (A) | F375: 6.4999999999999997e-003 | G375: 6.4000000000000004 | H375: 10.369999999999999 | I375: 171/258 | J375: FR | K375: 1990 | N375: mod配置/解除限速
A376: =A375+1 -> 374 | B376: Automation | C376: Fenekz | D376: Bussiness Gen2 | E376: A200 Sieben | F376: 6.5069444444444402e-003 | G376: 6.75 | H376: 10.289999999999999 | I376: 215/424 | J376: F4 | K376: 2020
A377: =A376+1 -> 375 | B377: Automation | C377: Fenekz | D377: V12 Gen1 | E377: A300 Turbodiesel Hydra Highline | F377: 6.5127314814814796e-003 | G377: 5.36 | H377: 8.0899999999999999 | I377: 295/567 | J377: F4 | K377: 1980
A378: =A377+1 -> 376 | B378: BeamNG | C378: Cherrier | D378: FCV | E378: Vivace 150d (DCT) | F378: 6.5150462962963e-003 | G378: 7.33 | H378: 12.9 | I378: 151/312 | J378: FF | K378: 2020 | L378: 1528
A379: =A378+1 -> 377 | B379: BeamNG | C379: Bruckell | D379: Moonhawk | E379: 378 Diesel Custom Sedan (M) | F379: 6.5254629629629603e-003 | G379: 6.14 | H379: 9.5999999999999996 | I379: 272/617 | J379: FR | K379: 1973 | L379: 1866 | N379: mod配置
A380: =A379+1 -> 378 | B380: Automation | C380: IND | D380: A0 AVP | E380: 1.2 TE S | F380: 6.5266203703703701e-003 | G380: 6.97 | H380: 8.4900000000000002 | I380: 110+50/147+60 | J380: F4 | K380: 2020 | N380: 单P3电机混动
A381: =A380+1 -> 379 | B381: BeamNG | C381: Bruckell | D381: LeGran | E381: Sport SE V6 AWD (Facelift,M) | F381: 6.5381944444444402e-003 | G381: 6.17 | H381: 10.34 | I381: 223/359 | J381: F4 | K381: 1989
A382: =A381+1 -> 380 | B382: Automation | C382: Fenekz | D382: Verve II | E382: 150d Highline | F382: 6.5405092592592598e-003 | G382: 7.32 | H382: 12.359999999999999 | I382: 146/355 | J382: FF | K382: 2020
A383: =A382+1 -> 381 | B383: BeamNG | C383: Gavril | D383: Roamer | E383: V8 RoadSport (A) | F383: 6.5532407407407397e-003 | G383: 6.77 | H383: 11.130000000000001 | I383: 293/558 | J383: F4 | K383: 1992
A384: =A383+1 -> 382 | B384: BeamNG | C384: Ibishu | D384: Diadem | E384: 40EX Luminaire Fultrac (A) | F384: 6.5555555555555497e-003 | G384: 6.96 | H384: 10.99 | I384: 253/350 | J384: F4 | K384: 1990 | L384: 1815 | N384: mod整车/解除限速
A385: =A384+1 -> 383 | B385: BeamNG | C385: Procyon | D385: Centauri | E385: U340TD (A) | F385: 6.5729166666666696e-003 | G385: 6.11 | H385: 9.4700000000000006 | I385: 352/691 | J385: F4 | K385: 2022 | L385: 2679 | M385: 14.33 | N385: mod整车
A386: =A385+1 -> 384 | B386: BeamNG | C386: Ibishu | D386: Covet | E386: 1.5 ZXi Special Edition (M) | F386: 6.5763888888888903e-003 | G386: 7.04 | H386: 12.98 | I386: 128/147 | J386: FF | K386: 1986
A387: =A386+1 -> 385 | B387: BeamNG | C387: Soliad | D387: Wendover | E387: Sport SE 3800 (A) | F387: 6.5775462962963001e-003 | G387: 7.06 | H387: 10.9 | I387: 225/361 | J387: FF | K387: 1987
A388: =A387+1 -> 386 | B388: BeamNG | C388: AW | D388: Astro | E388: 1.8 GTS (M) | F388: 6.5787037037037003e-003 | G388: 7.63 | H388: 13.529999999999999 | I388: 113/151 | J388: FF | K388: 1980 | N388: mod整车
A389: =A388+1 -> 387 | B389: BeamNG | C389: Ibishu | D389: Diadem | E389: Sovereign (A) | F389: 6.5833333333333299e-003 | G389: 4.29 | H389: 5.5300000000000002 | I389: 392/548 | J389: FR | K389: 1990 | L389: 1777 | M389: 13.1 | N389: mod整车
A390: =A389+1 -> 388 | B390: BeamNG | C390: Cherrier | D390: FCV | E390: Vivace E | F390: 6.5844907407407397e-003 | G390: 7.07 | H390: 13.74 | I390: 197/340 | J390: FF | K390: 2020 | L390: 1732 | M390: 15.35 | N390: 单电机纯电动/解除限速
A391: =A390+1 -> 389 | B391: BeamNG | C391: Ibishu | D391: Signia | E391: RZ-Z 1200 (M) | F391: 6.5960648148148098e-003 | G391: 6.45 | H391: 11.09 | I391: 158/169 | J391: FR | K391: 1974 | L391: 1141 | N391: mod整车/高性能散热器 | O391: 转子
A392: =A391+1 -> 390 | B392: BeamNG | C392: Gavril | D392: Barstow | E392: 423 V8 RoadSport Package (A) | F392: 6.61458333333333e-003 | G392: 6.03 | H392: 8.7599999999999998 | I392: 269/533 | J392: FR | K392: 1969 | L392: 1701 | M392: 14.779999999999999
A393: =A392+1 -> 391 | B393: BeamNG | C393: Cherrier | D393: Rayonner | E393: 200d (A) | F393: 6.6284722222222196e-003 | G393: 7.06 | H393: 12.029999999999999 | I393: 200/426 | J393: FR | K393: 2016 | N393: mod整车
A394: =A393+1 -> 392 | B394: BeamNG | C394: Ibishu | D394: Saga | E394: 2.6 VT6 AWS (M) | F394: 6.6400462962963001e-003 | G394: 7.33 | H394: 12. | I394: 158/185 | J394: FR | K394: 1988 | N394: mod整车
A395: =A394+1 -> 393 | B395: BeamNG | C395: Ibishu | D395: BX-Series | E395: 240BX LX (A) | F395: 6.6516203703703702e-003 | G395: 7.53 | H395: 12.529999999999999 | I395: 150/219 | J395: FR | K395: 1990
A396: =A395+1 -> 394 | B396: Automation | C396: Fenekz | D396: Hydra | E396: 25V6-190 Prestige Break | F396: 6.6655092592592599e-003 | G396: 7.47 | H396: 10.470000000000001 | I396: 191/237 | J396: FF | K396: 1990
A397: =A396+1 -> 395 | B397: BeamNG | C397: Ibishu | D397: BX-Series | E397: 200BX Type-L (M) | F397: 6.6736111111111102e-003 | G397: 7.81 | H397: 13.1 | I397: 145/188 | J397: FR | K397: 1990 | L397: 1260 | M397: 15.73
A398: =A397+1 -> 396 | B398: BeamNG | C398: Ibishu | D398: Pessima I | E398: U.S. Pessima 1.8SE-I (JDM-A) | F398: 6.6817129629629596e-003 | G398: 8.33 | H398: 11.470000000000001 | I398: 159/188 | J398: FF | K398: 1990 | L398: 1329 | N398: mod配置
A399: =A398+1 -> 397 | B399: BeamNG | C399: Ibishu | D399: Pessima Zenith I | E399: 1800 Touring-Li AWS (A) | F399: 6.6921296296296303e-003 | G399: 8.67 | H399: 12.93 | I399: 146/181 | J399: FF | K399: 1984 | N399: mod整车
A400: =A399+1 -> 398 | B400: BeamNG | C400: Ibishu | D400: Serenity | E400: 4.0 EX (A) | F400: 6.6979166666666697e-003 | G400: 7.94 | H400: 12.27 | I400: 175/329 | J400: FR | K400: 1984 | L400: 1537 | N400: mod整车
A401: =A400+1 -> 399 | B401: BeamNG | C401: Ibishu | D401: Serenity | E401: Taxi (A) | F401: 6.7048611111111102e-003 | G401: 7.97 | H401: 12.4 | I401: 175/329 | J401: FR | K401: 1984 | L401: 1546 | N401: mod整车
A402: =A401+1 -> 400 | B402: BeamNG | C402: Ibishu | D402: BX-Series | E402: Diana Base (M) | F402: 6.70601851851852e-003 | G402: 7.7999999999999998 | H402: 13.43 | I402: 145/188 | J402: FR | K402: 1990
A403: =A402+1 -> 401 | B403: BeamNG | C403: Gavril | D403: Grand Marshal | E403: Police Interceptor (A) | F403: 6.70601851851852e-003 | G403: 6.8700000000000001 | H403: 11.19 | I403: 241/446 | J403: FR | K403: 1990 | L403: 1909
A404: =A403+1 -> 402 | B404: BeamNG | C404: Gavril | D404: Grand Marshal | E404: V8 Luxe (A) | F404: 6.7106481481481496e-003 | G404: 7.3099999999999996 | H404: 11.76 | I404: 223/408 | J404: FR | K404: 1990 | L404: 1820
A405: =A404+1 -> 403 | B405: BeamNG | C405: Ibishu | D405: Pessima I | E405: 2.0 ZX AWS (M) | F405: 6.7106481481481496e-003 | G405: 7.63 | H405: 13.35 | I405: 151/182 | J405: FF | K405: 1988
A406: =A405+1 -> 404 | B406: BeamNG | C406: Arima | D406: AS100 Platform | E406: Caelo Grade R (M) | F406: 6.7118055555555551e-003 | G406: 6.86 | H406: 9.5 | I406: 162/168 | J406: FF | K406: 1993 | L406: 1025 | M406: 15.1 | N406: mod整车
A407: =A406+1 -> 405 | B407: Automation | C407: Currus | D407: 9000-Series V1 | E407: 9400Li | F407: 6.7164351851851803e-003 | G407: 7.78 | H407: 11.92 | I407: 180/281 | J407: FR | K407: 1985
A408: =A407+1 -> 406 | B408: BeamNG | C408: AW | D408: Astro | E408: 1.8 GTS (A) | F408: 6.7314814814814798e-003 | G408: 8.3000000000000007 | H408: 13.83 | I408: 113/151 | J408: FF | K408: 1980 | N408: mod整车
A409: =A408+1 -> 407 | B409: BeamNG | C409: Burnside | D409: Commander | E409: SXL 4WD (A) (4H) | F409: 6.7314814814814798e-003 | G409: 6.4400000000000004 | H409: 9.8800000000000008 | I409: 351/632 | J409: F4 | K409: 1999 | L409: 2495 | M409: 14.44 | N409: mod配置
A410: =A409+1 -> 408 | B410: BeamNG | C410: Ibishu | D410: Serenity | E410: 5.0 LX (A) | F410: 6.7337962962963002e-003 | G410: 7.14 | H410: 10.970000000000001 | I410: 192/368 | J410: FR | K410: 1984 | N410: mod整车 | O410: 100th
A411: =A410+1 -> 409 | B411: BeamNG | C411: Soliad | D411: Lansdale | E411: 3.8 Sport SE AWD (A) Facelift | F411: 6.7337962962963002e-003 | G411: 8.73 | H411: 14. | I411: 230/350 | J411: F4 | K411: 2003
A412: =A411+1 -> 410 | B412: BeamNG | C412: Bruckell | D412: LeGran | E412: Sport S V6 (M) | F412: 6.7349537037037031e-003 | G412: 7.83 | H412: 13.43 | I412: 170/272 | J412: FF | K412: 1984 | L412: 1575 | M412: 15.69
A413: =A412+1 -> 411 | B413: Automation | C413: Fenekz | D413: Protector | E413: A400-6 Wilderness | F413: 6.73726851851852e-003 | G413: 3.89 | H413: 5.2400000000000002 | I413: 436/707 | J413: F4 | K413: 2020 | L413: 2042 | O413: Off-Road Tire
A414: =A413+1 -> 412 | B414: BeamNG | C414: Burnside | D414: Windsor | E414: Enterprise Luxe L (A) | F414: 6.7418981481481496e-003 | G414: 7.66 | H414: 11.57 | I414: 223/408 | J414: FR | K414: 2001 | L414: 1806 | N414: mod整车
A415: =A414+1 -> 413 | B415: BeamNG | C415: Gavril | D415: Scout | E415: Tracer 330dX S25 AWD (A) | F415: 6.7488425925925901e-003 | G415: 7.57 | H415: 15.07 | I415: 163/338 | J415: F4 | K415: 2018 | N415: mod整车
A416: =A415+1 -> 414 | B416: BeamNG | C416: Burnside | D416: Lakewood | E416: 4WD SX Extended Cab (A) (Facelift) (4H) | F416: 6.7569444444444404e-003 | G416: 6.56 | H416: 11.359999999999999 | I416: 363/581 | J416: F4 | K416: 2002 | L416: 2398 | N416: mod车身
A417: =A416+1 -> 415 | B417: BeamNG | C417: 鹤丹 | D417: 护旗手 | E417: Late | F417: 6.7685185185185201e-003 | G417: 8.57 | H417: 13.789999999999999 | I417: 197/372 | J417: FR | K417: 2000 | L417: 1878 | N417: mod车身
A418: =A417+1 -> 416 | B418: BeamNG | C418: Gavril | D418: Scout | E418: Cargo 300d S25 (A) | F418: 6.7708333333333301e-003 | G418: 8.11 | H418: 15.69 | I418: 147/305 | J418: FF | K418: 2018 | L418: 1460 | N418: mod整车
A419: =A418+1 -> 417 | B419: BeamNG | C419: Ford | D419: Crown Victoria | E419: LX Sport | F419: 6.7847222222222198e-003 | G419: 7.99 | H419: 11.58 | I419: 242/389 | J419: FR | K419: 1998 | N419: mod整车
A420: =A419+1 -> 418 | B420: Automation | C420: Currus | D420: SU-XT | E420: XLE i-AWD | F420: 6.7870370370370402e-003 | G420: 7.03 | H420: 11.380000000000001 | I420: 195/307 | J420: F4 | K420: 2020
A421: =A420+1 -> 419 | B421: BeamNG | C421: Ibishu | D421: Lumiance O32 | E421: 1.8 SL (M) | F421: 6.7986111111111103e-003 | G421: 9.21 | H421: 17.07 | I421: 127/175 | J421: FF | K421: 1998 | L421: 1357 | N421: mod整车
A422: =A421+1 -> 420 | B422: BeamNG | C422: Hirochi | D422: Sunburst | E422: 1.8 (CVT) | F422: 6.8043981481481497e-003 | G422: 8.57 | H422: 12.390000000000001 | I422: 137/171 | J422: FF | K422: 2009 | L422: 1329 | M422: 16.550000000000001
A423: =A422+1 -> 421 | B423: BeamNG | C423: Burnside | D423: Windsor | E423: Sterling (A) | F423: 6.8159722222222198e-003 | G423: 8.5399999999999991 | H423: 13.470000000000001 | I423: 197/372 | J423: FR | K423: 2001 | L423: 1782 | N423: mod整车
A424: =A423+1 -> 422 | B424: BeamNG | C424: Gavril | D424: D-Series | E424: D35 V8 Daytona 4x4 (A) | F424: 6.8217592592592592e-003 | G424: 6.7599999999999998 | H424: 11.130000000000001 | I424: 325/530 | J424: F4 | K424: 2003 | L424: 2307 | M424: 14.720000000000001 | N424: mod配置
A425: =A424+1 -> 423 | B425: BeamNG | C425: Ford | D425: Crown Victoria | E425: Rapid Taxi | F425: 6.8229166666666698e-003 | G425: 9.1999999999999993 | H425: 12.06 | I425: 242/389 | J425: FR | K425: 1998 | L425: 2022 | N425: mod整车
A426: =A425+1 -> 424 | B426: BeamNG | C426: Ibishu | D426: Pessima Zenith II | E426: 2200 Touring-D Fultrac (M) | F426: 6.8275462962963003e-003 | G426: 7.99 | H426: 15.67 | I426: 142/262 | J426: F4 | K426: 1994 | N426: mod整车
A427: =A426+1 -> 425 | B427: BeamNG | C427: Gavril | D427: Grand Marshal | E427: Taxi (A) | F427: 6.8298611111111103e-003 | G427: 8.5 | H427: 14.1 | I427: 197/372 | J427: FR | K427: 1993 | L427: 1823
A428: =A427+1 -> 426 | B428: BeamNG | C428: Gavril | D428: Grand Marshal | E428: V8 Woody Wagon (A) | F428: 6.8344907407407399e-003 | G428: 7.93 | H428: 13.07 | I428: 223/408 | J428: FR | K428: 1990 | L428: 1980 | N428: mod车身
A429: =A428+1 -> 427 | B429: BeamNG | C429: Rayton | D429: Median | E429: 3.5 LSE (A) | F429: 6.84375e-003 | G429: 8.99 | H429: 12.06 | I429: 221/283 | J429: FF | K429: 1998 | L429: 1737 | N429: mod整车
A430: =A429+1 -> 428 | B430: BeamNG | C430: Gavril | D430: D-Series | E430: D10 Charro 423 Sport (A) | F430: 6.8495370370370403e-003 | G430: 6.76 | H430: 11.33 | I430: 273/498 | J430: FR | K430: 1986
A431: =A430+1 -> 429 | B431: BeamNG | C431: Ibishu | D431: CrossSport | E431: 2.7 Grand V6 [USDM] (A) | F431: 6.8541666666666699e-003 | G431: 7.24 | H431: 18.670000000000002 | I431: 181/280 | J431: F4 | K431: 2006 | L431: 1534 | N431: mod整车
A432: =A431+1 -> 430 | B432: BeamNG | C432: Ibishu | D432: Pessima II | E432: Taxi (A) | F432: 6.8553240740740701e-003 | G432: 8.99 | H432: 16.559999999999999 | I432: 127/175 | J432: FF | K432: 1996 | L432: 1280
A433: =A432+1 -> 431 | B433: BeamNG | C433: Cherrier | D433: FCV | E433: Tograq 150dQX (DCT) | F433: 6.86574074074074e-003 | G433: 8.17 | H433: 15.960000000000001 | I433: 151/312 | J433: F4 | K433: 2020 | L433: 1659
A434: =A433+1 -> 432 | B434: BeamNG | C434: Burnside | D434: Majesty | E434: SXL 4WD (4H) (A) | F434: 6.8668981481481497e-003 | G434: 6.72 | H434: 12.449999999999999 | I434: 363/652 | J434: F4 | K434: 2006 | L434: 2919 | N434: mod配置
A435: =A434+1 -> 433 | B435: BeamNG | C435: Gavril | D435: Vertex NA2 | E435: SE (A) | F435: 6.8703703703703704e-003 | G435: 8.91 | H435: 14.57 | I435: 140/199 | J435: FF | K435: 2007 | N435: mod整车
A436: =A435+1 -> 434 | B436: BeamNG | C436: Hirochi | D436: Sunburst | E436: 1.8 Hybrid Base [Facelift] (CVT) | F436: 6.875e-003 | G436: 6.30/11.36 | H436: 7.70/18.65 | I436: 130+145/146+212 | J436: FIRE | K436: 2015 | N436: mod配置/单P4电机混动
A437: =A436+1 -> 435 | B437: BeamNG | C437: Gavril | D437: Bluebuck | E437: 423 V8 Marshal 4-Door Hardtop (A) | F437: 6.8854166666666699e-003 | G437: 5.7999999999999998 | H437: 9.0600000000000005 | I437: 299/547 | J437: FR | K437: 1962
A438: =A437+1 -> 436 | B438: Automation | C438: Fenekz | D438: Verve II | E438: 90 Base | F438: 6.9004629629629598e-003 | G438: 10.76 | H438: 18.710000000000001 | I438: 94/171 | J438: FF | K438: 2020
A439: =A438+1 -> 437 | B439: Automation | C439: Visionow | D439: VS1 | E439: LITE 2025 | F439: 6.9004629629629598e-003 | G439: 7.5 | H439: 13.26 | I439: 113/181 | J439: FF | K439: 2020
A440: =A439+1 -> 438 | B440: BeamNG | C440: Ibishu | D440: Pessima I | E440: 2.0 LX (M) | F440: 6.9050925925925903e-003 | G440: 8.5600000000000005 | H440: 15.74 | I440: 141/179 | J440: FF | K440: 1988 | L440: 1317
A441: =A440+1 -> 439 | B441: Automation | C441: IND | D441: E3 | E441: 1.5TE D-Drive | F441: 6.9050925925925903e-003 | G441: 9.61 | H441: 11.130000000000001 | I441: 123+96/176+120 | J441: FF | K441: 2020 | N441: 发动机直驱+单P3电机辅助
A442: =A441+1 -> 440 | B442: Automation | C442: Dash | D442: Spadger | E442: 1.4 Sport | F442: 6.9097222222222199e-003 | G442: 8.66 | H442: 17.239999999999998 | I442: 78/102 | J442: FF | K442: 1965
A443: =A442+1 -> 441 | B443: Automation | C443: Fenekz | D443: 16 SWB | E443: 9000-4 (4H) | F443: 6.9375000000000001e-003 | G443: 7.47 | H443: 11.32 | I443: 321/616 | J443: F4 | K443: 1965 | L443: 2375
A444: =A443+1 -> 442 | B444: Automation | C444: IND | D444: EF4 | E444: 1.2TE D-Drive | F444: 6.9467592592592602e-003 | G444: 15.55 | H444: 12.1 | I444: 101+174/171+99 | J444: FF | K444: 2020 | N444: 发动机直驱+单P3电机辅助
A445: =A444+1 -> 443 | B445: BeamNG | C445: Ibishu | D445: Serenity | E445: 5.0 LX Limousine | F445: 6.9490740740740702e-003 | G445: 8.17 | H445: 11.26 | I445: 192/368 | J445: FR | K445: 1984 | N445: mod整车
A446: =A445+1 -> 444 | B446: BeamNG | C446: Ibishu | D446: Diadem | E446: 30LS Elegance Fultrac (A) | F446: 6.9664351851851797e-003 | G446: 8.83 | H446: 16.699999999999999 | I446: 198/265 | J446: F4 | K446: 1990 | L446: 1820 | N446: mod整车/解除限速
A447: =A446+1 -> 445 | B447: Automation | C447: Fenekz | D447: 16 SWB | E447: 9000-4 Tourer (4H) | F447: 6.9733796296296297e-003 | G447: 7.41 | H447: 11.32 | I447: 321/616 | J447: F4 | K447: 1965 | L447: 2350
A448: =A447+1 -> 446 | B448: BeamNG | C448: Cherrier | D448: FCV | E448: Vivace 110 (M) | F448: 6.97916666666667e-003 | G448: 10.44 | H448: 20.300000000000001 | I448: 110/185 | J448: FF | K448: 2020 | L448: 1418
A449: =A448+1 -> 447 | B449: BeamNG | C449: TAZ | D449: Mir/Zignet | E449: 1500 Konela Turbo Late | F449: 6.9942129629629599e-003 | G449: 8.07 | H449: 19.260000000000002 | I449: 123/188 | J449: FR | K449: 1988 | L449: 1179 | N449: mod整车
A450: =A449+1 -> 448 | B450: BeamNG | C450: ETK | D450: I-Series | E450: 2400 (M) | F450: 6.9976851851851901e-003 | G450: 9.81 | H450: 20.059999999999999 | I450: 132/182 | J450: FR | K450: 1985
A451: =A450+1 -> 449 | B451: BeamNG | C451: Ibishu | D451: Claria | E451: GTz 2600 (M) | F451: 7.00347222222222e-003 | G451: 7.73 | H451: 15.44 | I451: 170/233 | J451: FR | K451: 1976
A452: =A451+1 -> 450 | B452: BeamNG | C452: Ibishu | D452: Miramar | E452: GTz (M) | F452: 7.0370370370370404e-003 | G452: 7.91 | H452: 17.73 | I452: 115/156 | J452: FR | K452: 1963 | N452: 高性能散热器
A453: =A452+1 -> 451 | B453: BeamNG | C453: Arima | D453: Hestia | E453: 6-Seat Journey Olympiad AWD (A) | F453: 7.0567129629629599e-003 | G453: 10.04 | H453: 21.370000000000001 | I453: 133/179 | J453: F4 | K453: 1997 | L453: 1370 | N453: mod整车
A454: =A453+1 -> 452 | B454: BeamNG | C454: Hirochi | D454: Aurata | E454: Sport Turbo (CVT) | F454: 7.0590277777777778e-003 | G454: 5.01 | H454: Vmax 141 | I454: 188/194 | J454: M4 | K454: 2016 | L454: 878 | M454: 13.970000000000001
A455: =A454+1 -> 453 | B455: BeamNG | C455: Ibishu | D455: Pessima II | E455: 2.2 XG-D TURBO (JDM-A) | F455: 7.0810185185185203e-003 | G455: 10.4 | H455: 23.329999999999998 | I455: 112/215 | J455: FF | K455: 1996 | L455: 1408 | N455: mod配置
A456: =A455+1 -> 454 | B456: BeamNG | C456: Ibishu | D456: Diadem | E456: 2.5EE (CVT) | F456: 7.0810185185185203e-003 | G456: 9.39 | H456: 16.620000000000001 | I456: 165/246 | J456: FR | K456: 1990 | L456: 1782 | N456: mod整车/解除限速
A457: =A456+1 -> 455 | B457: BeamNG | C457: Hirochi | D457: Ute | E457: Hirochi RUSH S (M)(4H) | F457: 7.0925925925925896e-003 | G457: 10.08 | H457: 18.109999999999999 | I457: 108/134 | J457: F4 | K457: 1982 | L457: 1181 | N457: mod整车
A458: =A457+1 -> 456 | B458: BeamNG | C458: Gavril | D458: Dynamo | E458: Late Convertible | F458: 7.1099537037036999e-003 | G458: 7.5 | H458: 12.23 | I458: 240/485 | J458: FR | K458: 1962 | N458: mod整车/高性能散热器
A459: =A458+1 -> 457 | B459: Automation | C459: Fenekz | D459: Verve II | E459: 3-Door 3L | F459: 7.1423611111111097e-003 | G459: 13.09 | H459: 25.969999999999999 | I459: 67/139 | J459: FF | K459: 2020
A460: =A459+1 -> 458 | B460: BeamNG | C460: AW | D460: Bete | E460: Classic 1.3 (M) | F460: 7.1458333333333304e-003 | G460: 9.1300000000000008 | H460: 34.329999999999998 | I460: 75/109 | J460: FF | K460: 1990 | N460: mod整车
A461: =A460+1 -> 459 | B461: BeamNG | C461: Ibishu | D461: Hopper | E461: LXT-6 (A) | F461: 7.1736111111111098e-003 | G461: 8.7100000000000009 | H461: 23.48 | I461: 165/296 | J461: F4 | K461: 1991
A462: =A461+1 -> 460 | B462: BeamNG | C462: Gavril | D462: D-Series | E462: D15 V8 4WD (A)(4H) | F462: 7.1944444444444399e-003 | G462: 10.07 | H462: 24.030000000000001 | I462: 197/372 | J462: F4 | K462: 1992
A463: =A462+1 -> 461 | B463: BeamNG | C463: Bruckell | D463: Moonhawk | E463: 378 V8 LeGran Sedan (A) | F463: 7.2002314814814802e-003 | G463: 9.3699999999999992 | H463: 19.43 | I463: 185/381 | J463: FR | K463: 1976 | N463: mod车身
A464: =A463+1 -> 462 | B464: BeamNG | C464: Gavril | D464: D-Series | E464: D35 Chief Rancher Diesel (A)(4H) | F464: 7.2372685185185196e-003 | G464: 10.16 | H464: 21.27 | I464: 245/606 | J464: F4 | K464: 1998
A465: =A464+1 -> 463 | B465: BeamNG | C465: Gavril | D465: H-Series | E465: H35 4WD Vanster (A)(4H) | F465: 7.2407407407407403e-003 | G465: 9.5 | H465: 19.289999999999999 | I465: 259/463 | J465: F4 | K465: 1993
A466: =A465+1 -> 464 | B466: BeamNG | C466: Ibishu | D466: CrossSport | E466: 2.0 Taxi (North America) (A) | F466: 7.3009259259259303e-003 | G466: 9.5099999999999998 | H466: Vmax 156 | I466: 145/185 | J466: FF | K466: 2006 | L466: 1494 | N466: mod整车
A467: =A466+1 -> 465 | B467: BeamNG | C467: Gavril | D467: D-Series | E467: D35 Chief Rancher V8 Dually (A) | F467: 7.3518518518518499e-003 | G467: 10.1 | H467: 22.309999999999999 | I467: 235/443 | J467: FR | K467: 1986
A468: =A467+1 -> 466 | B468: BeamNG | C468: Soliad | D468: Lansdale | E468: Taxi (A) | F468: 7.3796296296296301e-003 | G468: 13.210000000000001 | H468: 30.640000000000001 | I468: 140/221 | J468: FF | K468: 1996
A469: =A468+1 -> 467 | B469: BeamNG | C469: Ibishu | D469: Diadem | E469: Japanese Taxi (M) | F469: 7.4537037037037002e-003 | G469: 11.57 | H469: 30.129999999999999 | I469: 140/218 | J469: FR | K469: 1990 | L469: 1787 | N469: mod整车
A470: =A469+1 -> 468 | B470: BeamNG | C470: Gavril | D470: Roamer | E470: Diesel V8 LXT35 (A) (4H) | F470: 7.4803240740740698e-003 | G470: 12.34 | H470: 31.789999999999999 | I470: 181/514 | J470: F4 | K470: 1992 | L470: 2730 | M470: 18.170000000000002
A471: =A470+1 -> 469 | B471: BeamNG | C471: Ibishu | D471: Pessima Zenith I | E471: 1800 GS Turbodiesel (A) | F471: 7.4849537037037003e-003 | G471: 12.970000000000001 | H471: 32.43 | I471: 96/192 | J471: FF | K471: 1984 | L471: 1339 | N471: mod整车
A472: =A471+1 -> 470 | B472: BeamNG | C472: Autobello | D472: Piccolina | E472: 130 B (M) | F472: 7.5104166666666696e-003 | G472: 10.51 | H472: Vmax 155 | I472: 62/98 | J472: RR | K472: 1969
A473: =A472+1 -> 471 | B473: Automation | C473: Fenekz | D473: 16 EWB | E473: 9000 Landaulet-4 (4H) | F473: 7.5706018518518501e-003 | G473: 9.4499999999999993 | H473: 14.789999999999999 | I473: 321/616 | J473: F4 | K473: 1965 | L473: 3108
A474: =A473+1 -> 472 | B474: BeamNG | C474: Gavril | D474: H-Series | E474: H15 Vanster (A) | F474: 7.5763888888888903e-003 | G474: 11.300000000000001 | H474: 26.789999999999999 | I474: 197372 | J474: FR | K474: 1993
A475: =A474+1 -> 473 | B475: BeamNG | C475: Seongchwi | D475: Ilkkun | E475: Standard Facelift (M) | F475: 7.6006944444444403e-003 | G475: 12.77 | H475: 31.670000000000002 | I475: 94/120 | J475: FR | K475: 2005 | L475: 1429 | N475: mod整车
A476: =A475+1 -> 474 | B476: BeamNG | C476: Bruckell | D476: Moonhawk | E476: 378 Diesel (A) | F476: 7.6874999999999999e-003 | G476: 13.27 | H476: 41.43 | I476: 136/327 | J476: FR | K476: 1973 | L476: 1797 | N476: mod配置
A477: =A476+1 -> 475 | B477: BeamNG | C477: Bruckell | D477: LeGran | E477: Taxi Wagon (A) | F477: 7.7094907407407398e-003 | G477: 13.94 | H477: 57.640000000000001 | I477: 102/190 | J477: FF | K477: 1984
A478: =A477+1 -> 476 | B478: BeamNG | C478: Ibishu | D478: CrossSport | E478: Hydrogen Prototype (A) | F478: 7.8275462962962995e-003 | G478: 13.43 | H478: Vmax 141 | I478: 110/147 | J478: F4 | K478: 2006 | L478: 1548 | N478: mod整车
A479: =A478+1 -> 477 | B479: BeamNG | C479: Gavril | D479: Durham | E479: C45 Chassis Cab 4x4 (A)(4H) | F479: 7.8518518518518494e-003 | G479: 9.9000000000000004 | H479: 15.1 | I479: 341/614 | J479: F4 | K479: 2000 | N479: mod整车
A480: =A479+1 -> 478 | B480: BeamNG | C480: Gavril | D480: Bluebuck | E480: Taxi (A) | F480: 7.8912037037037006e-003 | G480: 12.359999999999999 | H480: Vmax 156 | I480: 122/282 | J480: FR | K480: 1962
A481: =A480+1 -> 479 | B481: Automation | C481: Fenekz | D481: Hydra | E481: 25V6-140 Safari Top Gear Tribute | F481: 7.9074074074074099e-003 | G481: 10.56 | H481: 22.16 | I481: 140/214 | J481: FF | K481: 1988
A482: =A481+1 -> 480 | B482: BeamNG | C482: Autobello | D482: Stambecco | E482: 525-C-2 Rally (M) | F482: 7.9513888888888898e-003 | G482: 11.93 | H482: Vmax 140 | I482: 243/501 | J482: M6 | K482: 1989 | N482: 赛车
A483: =A482+1 -> 481 | B483: BeamNG | C483: Burnside | D483: Special | E483: Taxi (M) | F483: 7.9618055555555605e-003 | G483: 10.9 | H483: 45.57 | I483: 155/351 | J483: FR | K483: 1953 | N483: 高性能散热器
A484: =A483+1 -> 482 | B484: Automation | C484: Citroen | D484: DS | E484: 21 Pallas | F484: 8.0277777777777795e-003 | G484: 10.76 | H484: Vmax 156 | I484: 105/148 | J484: FF | K484: 1970 | N484: 同人作品（非真车）
A485: =A484+1 -> 483 | B485: BeamNG | C485: Burnside | D485: Special | E485: V8 Dual-Matic (A) | F485: 8.0972222222222192e-003 | G485: 12.03 | H485: 56.409999999999997 | I485: 155/351 | J485: FR | K485: 1953 | N485: 高性能散热器
A486: =A485+1 -> 484 | B486: BeamNG | C486: Hirochi | D486: Talent | E486: 4WD Power Deluxe Super Charger [Late] (M) | F486: 8.1550925925925905e-003 | G486: 13.06 | H486: Vmax 129 | I486: 63/83 | J486: R4 | K486: 1996 | N486: mod整车
A487: =A486+1 -> 485 | B487: BeamNG | C487: Segra | D487: Ultimat | E487: 4x2 Launch Edition 790 (A) | F487: 8.3217592592592596e-003 | G487: 14.35 | H487: Vmax 141 | I487: 802/4000 | J487: FR | K487: 2018 | L487: 9500 | M487: 20.370000000000001 | N487: mod整车/解除限速
A488: =A487+1 -> 486 | B488: BeamNG | C488: AW | D488: Astro | E488: 1.3 (A) | F488: 8.4270833333333298e-003 | G488: 20.74 | H488: Vmax 149 | I488: 50/76 | J488: FF | K488: 1980 | N488: mod整车
A489: =A488+1 -> 487 | B489: BeamNG | C489: TAZ | D489: Baikal | E489: 1500 Tour (4H) | F489: 8.5856481481481495e-003 | G489: 17.399999999999999 | H489: Vmax 116 | I489: 78/133 | J489: F4 | K489: 2012 | L489: 1159 | N489: mod整车
A490: =A489+1 -> 488 | B490: BeamNG | C490: Seongchwi | D490: Ilkkun | E490: Taxi (M) | F490: 8.5949074074074105e-003 | G490: 20. | H490: Vmax 141 | I490: 68/135 | J490: FR | K490: 1987 | L490: 1439 | N490: mod整车
A491: =A490+1 -> 489 | B491: BeamNG | C491: TAZ | D491: Baikal | E491: 1500 (4H) | F491: 8.8738425925925894e-003 | G491: 21.38 | H491: Vmax 114 | I491: 74/128 | J491: F4 | K491: 1981 | L491: 1174 | N491: mod整车
A492: =A491+1 -> 490 | B492: BeamNG | C492: Gavril | D492: MD-Series | E492: MD60 Ambulance (A) | F492: 9.1782407407407403e-003 | G492: 19.67 | H492: Vmax 112 | I492: 312/948 | J492: FR | K492: 1992 | L492: 6531 | M492: 21.760000000000002
A493: =A492+1 -> 491 | B493: BeamNG | C493: Gavril | D493: Dynamo | E493: Belasco City Jetstream Police (A) | F493: 9.2592592592592605e-003 | G493: 24.34 | H493: Vmax 154 | I493: 644/380 | J493: FR | K493: 1962 | L493: 1975 | N493: mod整车
A494: =A493+1 -> 492 | B494: BeamNG | C494: TAZ | D494: Mir/Zignet | E494: 1200 | F494: 9.2893518518518507e-003 | G494: 21.99 | H494: Vmax 106 | I494: 54/94 | J494: FR | K494: 1979 | L494: 1080 | N494: mod整车
A495: =A494+1 -> 493 | B495: BeamNG | C495: Ibishu | D495: Pigeon | E495: Plus (M) | F495: 9.7708333333333293e-003 | G495: 30.77 | H495: Vmax 117 | I495: 31/45 | J495: FR | K495: 1980
A496: - | B496: Automation | C496: Apache | D496: Chrechy | E496: Gran Coupe X Mystic | F496: 4.3946759259259303e-003 | G496: 2.33 | H496: 2.23 | I496: 737+1357/1101+1250 | J496: F4 | K496: 2020 | N496: 单P3电机混动 | O496: 修改数据
A499: 最速前驱公路车：2020 Visionow VS3 WTCR Edition 7:16.2
A500: 最速四门公路车：2020 Fenekz Tempest 550x P&L Nür 6:48.2
A501: 最速柴油公路车：2015 ETK K-Series Kc6x 380d (A) 8:01.5
A502: 最速原厂公路SUV：2015 ETK 1300-Series 1358 ttSport+ 7:57.3
A503: 最速纯电动车：2020 Fenekz Executive Electrified R 85-Package 6:24.8
A504: 最高尾速：2022 Bugatti Chiron Super Sport 300+ 413km/h